뉴스제목,주가변동
 시황  국내증시  강세  마감 코스피  외인 기관 매수,0
 마감시황 코스피  FOMC 안도감에 상승     선 회복,0
코스피    Fed  제로 금리  유지에 상승       올라,0
 마감  코스피 외인 기관  쌍끌이  매수에 상승,0
 시황종합  연준  훈풍  코스피      올라     선 SK바사 따상 데뷔,0
 fn오전시황 코스피  FOMC 결과에 안도하며     선 안착,0
코스닥  FOMC 훈풍에 상승 출발     선 ,0
 클릭 e종목  디앤씨미디어 K 웹툰의 보석 ,0
위기의 하나 모두투어  주가 코로나 이전으로 회복한 이유,0
 fn마감시황 코스피  FOMC 안도감에     선 회복,0
 FOMC 안도감  코스피      상승      대 마감,0
 오디션 대부  한동철  작년 연봉   억 나영석보다 더 벌었다,0
나영석PD   억 이명한PD   억 이보다 연봉 더 많은 PD는 누구,0
 시황종합     갈등 기류에 코스피         선 개인은  조 샀다,0
코스피    대 하락 마감       선 위협,0
 시황  개인    매수에도  약세  코스피      선 턱걸이 마감,0
 코스닥 마감    갈등에  일 만에 하락     선 ,0
 마감  코스피  개미  조  사자 에도           선까지 밀려,0
코스피  외국인 기관 순매도에    하락 마감  천선대로 후퇴,0
한류 열기에 문화예술저작권 수지 첫 흑자전환,0
 천억 이상 콘텐츠 투자 나선 KT  디즈니  와도 협력,0
코스피 소폭 상승     선 코스닥도 오름세,0
코스닥  뉴욕증시 호조에 상승 출발     선 ,0
 마감시황 코스피    EU   갈등에    하락     선 후퇴,0
 단독  M A로 미래 충전 현대차는 기술영토 확장  네이버는 동맹강화,0
 시황  개인 홀로  사자  코스피  하루만에     선 회복,0
코스피  하루 만에     선 회복   개인 홀로  사자 ,0
 시황종합  코스피      상승     선 회복         마감,0
 코스닥 마감  기술주 급락에도  거래일 상승     선 ,0
 마감시황 코스피  등락 끝에     선 회복,0
 마감  코스피  개인 매수에 상승  하루 만에     선 회복,0
 오후 주식시장은 오전 회복했던      선 다시 내준 코스피,0
코스피  개인 매수세 힘입어     선서 거래,0
코스닥  외인 기관  팔자 에 하락 출발     선 ,0
개인 외국인 순매수세에 코스피     선 탈환,0
코스피 장초반 상승     선 회복 개인 외인  사자 ,0
 마감시황 코스피  외인 기관  사자 에     선 회복,0
 시황종합  코스피    넘게 올라     선 마감 외인 기관  쌍끌이 ,0
코스피  외국인 기관  사자 에     선 회복       상승,0
 시황  외국인 기관 쓸어담았다 코스피      상승,0
 코스닥 마감 기관  인 동반 매수에 상승 마감    선,0
코스피    상승     선 기관 외인 동반 매수,0
코스피 장초반 상승     선 외인 기관  사자 ,0
코스피  외국인  사자 에 장중     선 회복,0
유진   스튜디오드래곤  한국판 마블급 유니버스 탄생 ,0
 STOCK   스튜디오드래곤  와이랩 업고 한국판 마블 유니버스 노린다 ,0
조선구마사 이어 설강화 역사 왜곡 논란 K 콘텐츠  악재될까,0
    역사왜곡 드라마  논란 YG엔터  엔터업계로 손 뻗는   자본,0
 미리보는 이데일리 신문  비적정 상장사  속출 증시 상폐 공포,0
수에즈 운하 사태에 돋보이는  조선업 주가도  활짝 ,0
 시황종합       바라보던 코스피  상승분 반납하고     선 마감,0
 시황  국내증시  외인 기관 매도에  약세  마감,0
 코스닥 마감 외인 기관 매도에  하락     선,0
코스피  기관 외국인 매도세에     선 반납       하락,0
코스피 장초반 소폭 상승     선 코스닥도 올라,0
코스피      선 공방 개인 매수세에 소폭 상승,0
코스닥  개인  사자 에 상승 출발     선 ,0
 인프라 투자 훈풍 코스피     기관 순매수에      안착,0
 시황종합    훈풍에 코스피     선 회복 외인 기관 쌍끌이,0
 시황  코스피  외인 기관 쌍끌이 매수에  강세  마감,0
코스피  외국인 기관  쌍끌이 매수 에     선 넘어,0
 코스닥 마감   인프라 투자 훈풍에 상승   일만에     선 ,0
  훈풍에 코스피     선 넘어 외인 기관 쌍끌이 매수,0
스튜디오드래곤   Q 영업익        디즈니   나비효과  날까,0
 개장시황    인프라 투자 기대감 코스피     대 회복,0
 미국발 훈풍  코스피     선 돌파 대장주 삼성전자      ,0
외인 기관 쌍매수에 상승출발 코스피      재탈환,0
코스닥    초대형 인프라 투자 영향에 상승 출발     선 육박 ,0
코스피  한 달여 만에     포인트 회복,0
하나금투  스튜디오드래곤   분기 실적 추정치 상회 전망 목표가  ,0
스튜디오드래곤  글로벌 OTT 수혜 톡톡 목표가  하나금투,0
하나금투  스튜디오드래곤 실적 개선 기대 이상 목표가    상향 ,0
스튜디오드래곤  디즈니 플러스 나비효과 목표가  하나,0
 왜 미국 주식만 하세요   테슬라 없이      벌었다  부터뷰 ,0
하나금융투자  스튜디오드래곤  글로벌 OTT 수혜로 실적 증가 전망 ,0
 조간브리핑  구글  카카오모빌리티에 투자 모빌리티 시장 경쟁 격화되나,0
스튜디오드래곤  올    분기 실적 컨센서스 대폭 상회 전망 하나금투,0
 시황  코스피  개인 외국인 매수에  강세      선 마감,0
외인  엿새째  사자  행진 코스피 거래대금만   조,0
 시황종합  코스피  일째 상승     선 마감 외국인  일째 사자,0
 코스닥 마감 이틀째 올라    선 회복 씨젠 강세,0
 마감시황 코스피  개인 외인 매수에 상승     대 마감,0
 마감시황 외국인 수급에 등락 반복   코스피 강보합세 마감,0
 마감  코스피  개인 외인 쌍끌이 매수에 상승      선 안착,0
    클릭 에 움직인 코스피  장 중 등락 계속 건설   강세 ,0
외국인 순매수 전환 코스피 강보합     선 회복,0
 옵션만기일  코스피  거래일만에 하락     선 밀려,0
기관 외인 매도에 코스피 하락 출발     대에서 등락,0
 오전시황 외국인 기관 매도 속  코스피 소폭 하락세,0
옵션만기일 맞은 코스피  소폭  하락  삼성전자 이틀째  약세 ,0
장초반 다시 돌아선 외인  코스피     선 등락,0
대원미디어 주가 한달새  배  껑충 ,0
 돌아온 외국인  코스피 반등 성공,0
외인  일만에  팔자  숨고른 코스피  비중확대 기회 ,0
 시황종합  코스피            선 밀려 외국인  일만에 팔자,0
코스피  인플레 우려로  거래일 만에 하락,0
 시황  엇갈린 국내증시 코스피  외인 기관 매도에  약세 ,0
 마감  코스피  외인 기관  팔자 에 하락      선으로 밀려,0
 마감시황 코스피   거래일 만에 하락     선 마감,0
코스피  외국인 기관  팔자 에 하락 SK바사    ,0
 코스닥 마감 외인 매수에  거래일 연속 상승     선  코앞,0
코스닥 오르니 시총 서열도  엎치락뒤치락 ,0
코스피 장초반 보합권 등락 개인 나홀로 사자,0
 개장시황 미국  훈풍에 코스피 코스닥 상승세,0
코스닥   기술주 강세에 상승 출발     선 ,0
바이오  끌고   차전지 게임 콘텐츠  밀고  확 달라진 포트폴리오,0
코스닥    년  개월 만에  천스닥  됐다,0
 OTT 쩐의 전쟁 투자 뭉칫돈 종착지는  제작사 ,0
코스닥  닷컴버블 이후 첫  천스닥  돌파   상승 이끈 배경은,0
  년  개월만에      넘긴 코스닥  상승세 이어질 것 ,0
외국인 기관 사자 코스닥   년만에     선 돌파,0
 fn마감시황 코스닥    년만에     선 넘겨 코스피도 소폭 상승,0
 시황  국내증시  강세  코스닥    년 만에     선 회복,0
코스피 개인  사자 로     선   코스닥      돌파,0
 마감시황 코스닥    년만에     선 마감 코스피       상승,0
 코스닥 마감   년 개월만에     선 탈환 드디어 천스닥,0
 마감  코스피  개인 매수에     선  코스닥은   년만에     선 돌파,0
 시황종합  코스닥        p 마감    년 개월만의  천스닥 ,0
코스닥       돌파 종가 기준   년  개월 만,0
코스닥  종가기준  천 돌파          마감,0
코스닥   개월만에     선 탈환 외국인 기관 사자,0
혼조세 속 코스피 장중 하락 전환되기도,0
 천덕꾸러기  코스닥의 반격 바이오 앞세워     포인트 재돌파 위협   포트라이   ,0
강보합 나타내는 코스피 반도체 추이 지켜봐야,0
바이오 앞세워  천스닥 복귀  힘 실린다,0
 마감시황 코스피      선 턱밑 마감 연기금 한달만  사자  종합 ,0
 시황  코스피  개인 매수에 상승     선 코앞 마감,0
코스피      선 안착 실패 소폭 상승 마감,0
 마감  코스피      선 턱 밑 마감  코스닥은     선 돌파,0
 마감시황 코스피      선 턱밑 마감 개인 순매수,0
 마감시황 코스피      선 코앞 마감   코스닥은      선 돌파,0
코스피      선 턱 밑 마감 개미 매수세 역부족,0
 시황종합  코스피      턱밑 마감 연기금   일만에 순매수,0
 오후주식시장은 코스피  외인 기관  팔자 에 보합세,0
 분기 실적시즌 개막   주린이라면 이건 꼭 알아야지  한경제의 솔깃한 경제  주   ,0
코스피  이틀 연속 장중     선 넘어 코스닥도     선,0
 오전시황 코스피    증시 사상 최대치 경신에       재돌파,0
스튜디오드래곤  양적 질적 동반 성장 이어갈 것 키움,0
 STOCK  스튜디오드래곤  넷플릭스 효과 톡톡  콘텐츠 활황에 목표가 ,0
 스튜디오드래곤  K 콘텐츠 호황 수혜 기대 목표가  ,0
K 콘텐츠 초호화 국면 스튜디오드래곤 목표주가  키움,0
 클릭 e종목  확실한  등으로 격차 벌리는 스튜디오드래곤,0
스튜디오드래곤  올해 콘텐츠시장 활황에 견조한 성장세 목표가  키움,0
 차영주의 금요시장  삼성전자 배당금 날 단기 수익 노린다면 SK하이닉스 사야 ,0
코스피   증시 사상 최대치 기록에     선 유지,0
 마감시황      선 고지 안착한 코스피  사상 최고점 찍다,0
 코스닥 마감 개인 사자에  거래일째 상승     선,0
코스닥  외인 기관 팔자에 하락 출발     선,0
IBK  스튜디오드래곤 목표가 상향  해외 OTT 국내 진출 호재 ,0
스튜디오드래곤   Q 시장 컨센 소폭 상회 목표가  IBK,0
스튜디오드래곤  실적 개선세 이어진다 목표주가  IBK,0
IBK투자증권  스튜디오드래곤  실적 개선세 이어질 것 ,0
 스튜디오드래곤  실적개선 뚜렷 목표가 상향  IBK투자증권,0
삼성자산운용  핫 종목 편입 코덱스ETF  종 추천 ,0
삼성자산운용  Hot 종목 편입 KODEX ETF  선 발표,0
 테슬라 카카오 하이브  KODEX ETF로 투자하세요 ,0
삼성운용   Hot 종목  편입 KODEX ETF  선 발표,0
삼성자산운용  핫 종목 편입 코덱스ETF  선 추천 ,0
 코스닥 마감 외인 기관 순매수에 상승     선,0
코스닥  개인 나홀로  사자 에 상승 출발      선 ,0
개인  사자  코스피 장 초반 상승 출발,0
 시황  국내증시  상승  코스피  개인 사자에     선 마감,0
 마감  코스피  개인 사흘째  사자  행진      선 탈환,0
 시황종합  코스피      올라     선 마감 코스닥도 소폭 상승,0
코스피    세금 이슈에도 상승 마감    내주 전고점 재도전 ,0
 마감시황 코스피  등락 끝에 강보합 마감     선 회복,0
 코스닥 마감 기관 외인 동반 매수에 강보합      선 ,0
 오후시황  코스피  개인 기관 매수에 오후 들어 상승전환        선 회복,0
코스피       선  보합권 등락   개인 기관 동반 순매수,0
코스피 보합권 등락 개인 기관 순매수,0
코스피 장중 강보합 전환     선 코스닥도 소폭 오름세,0
코스닥  상승전환해      선  정보기기    오름세,0
코스피    증시 약세에      하락     선 코스닥      ,0
코스닥  개인 홀로  사자  속 하락 출발      선 등락 ,0
코스피  장 초반     선까지 밀리며 하락 출발,0
코스피     선 회복  실적개선 기대되는 테크주 담을까  ,0
 시황  국내증시  강세  마감 코스피  외인 홀로  사자 ,0
 마감  코스피  외국인 기관 쌍끌이 매수          마감,0
 마감시황 코스피  외국인 매수에     선 안착,0
 시황종합   외인 사자  코스피    상승          최고치 턱밑 ,0
코스피  외국인  사자 에  거래일 만에     선 재돌파,0
코스피  외국인  사자 에 상승          마감,0
조용하던 네시삼십삼분  반전 승부수 나오나,0
 외인 기관 사자  코스피     선 회복 환율  원 ,0
코스피  거래일만에 장중     선 회복 외인 기관  사자 ,0
바이드노믹스 수혜주 외국인 기관은 벌써 담고 있네,0
동학개미 차익실현 vs 돌아온 외국인 코스피      분투,0
코스피  개인 순매수에 장중      터치,0
코스피      상승     선 개인 홀로  사자 ,0
 코스닥 마감 외인 기관 매도에 하락     선,0
코스피 장초반 약보합     선 외인 기관 동반 매도,0
코스피      선 놓고 힘겨루기,0
코스닥  상승 출발후 하락 전환     선 하회,0
CJ ENM  케이블 부진 지속  디지털은 혁신 중 IBK,0
백신 탓인가 공매도 탓인가 나흘째 출렁인 증시,0
온라인 게임포털에서 국내 대표 모바일 명가로,0
 마감시황  코스피  일 연속 하락 행진     선 뚫렸다,0
 마감시황 코스피    거래일 만에      선 내줘,0
 시황  코스피  공매도 앞두고 나흘째 약세 외인 기관 팔자,0
코스피    증시 호조에도 나흘째 약세     선 아래로  뚝 ,0
기관 외국인  팔자 에     선까지 밀려  단계적 내수 회복 기대 ,0
 마감시황 코스피  외국인 매도에      하락     선  뒷걸음 ,0
코스피      선  털썩  외인     억 규모  팔자 ,0
 코스닥 마감  공매도 공포 에 거래대금 급감     선 까지 하락,0
 시황종합   공매도 재개 D    코스피  일째 하락     선 마감,0
 마감  코스피  외국인 기관  팔자 에 나흘째       선까지 후퇴,0
 마감시황  외국인  팔자  행렬 코스피 코스닥 하락 마감,0
기관 외국인 매도에 코스피 약보합세,0
 오후 주식시장은 공매도 재개 전 마지막 거래일   코스피 코스닥 약세,0
 공매도 재개 D    코스피  일째 하락 코스닥    선 후퇴,0
코스닥  하락 폭   대 확대     선   커지는 공매도 우려 ,0
 장중시황  외인 기관 쌍매도 코스피     선  터치 ,0
코스피 등락 반복   월도 기대와 우려 섞일 것 ,0
공매도 재개 부담 외국인 기관  팔자  코스피 코스닥  털썩 ,0
연기금  공매도 틈타 등판   LGD 현대차 등 매수 타깃,0
네이버냐 카카오냐   ICT 대장주는 누구 ,0
 마켓뷰  코스피 코스닥  장 막판 상승 전환 공매도 영향은 줄어,0
공매도 재개 이틀만에 코스피  반등  코스닥도 상승 마감,0
 시황  공매도 재개 이틀 만에 반등 코스피         마감,0
 마감시황  공매도 이틀째 코스피 코스닥 상승 마감,0
 시황종합  공매도 이틀만에 반등 코스피        코스닥       ,0
 마감  공매도 재개 이틀만에 반등  코스피     선 마감,0
공매도 융단폭격 하루만에 극복  셀트리온  형제 급반등,0
 공매도 이틀째  변동성 크지만 코스닥 낙폭 축소 셀트리온 반등,0
 공매도 이틀째  코스닥    넘게 하락    선 밑으로 변동성 커져,0
 공매도 재개 이틀째  개미 매수에도 코스닥     깨졌다,0
공매도 이틀째 변동성  코스닥 낙폭 축소  셀트리온  형제 반등 ,0
코스닥  낙폭    가까이 확대 한 달여만에     선 ,0
공매도 재개 D    코스피 상승 출발 후     선  약세 ,0
공매도 공포에서 벗어난 국내증시 코스피 코스닥 반등,0
공매도 공포에 흔들리는 코스닥  장초반       ,0
미래에셋  영업익      억  분기 최대    풍력주 씨에스윈드 이익     급   ,0
스튜디오드래곤  Q 영업익    억원,0
 시황종합   옐런 금리 발언 에도 코스피    상승 은행주 강세,0
 마감시황 경기민감주 강세에 코스피    올라,0
기관 매수세에 코스피     상승 마감,0
코스피  경기 회복 기대감에    상승 옐런 발언에 금융주 강세,0
스튜디오드래곤   여신강림   빈센조 덕에 영업이익       ,0
 시황  코스피      p 상승        으로 마감,0
 마감  공매도 충격 벗어나나  코스피      선 안착,0
코스피    상승 마감  코스피 수급 환경 대형주에 우호적 ,0
스튜디오드래곤   분기 영업익    억  전년      성장,0
 코스닥 마감 개인 순매수에 소폭 상승    선  코앞 ,0
 마감시황 코스피    금리 우려에도    상승,0
 마감시황  코스피 상승세     대,0
 오후시황  오후에도 코스피는 상승 폭 유지,0
개인 기관 매수에 코스피 강보합세,0
 외인 기관 팔자  코스닥 약세  공매도  코스닥       넘게 하락,0
 일 장 마감 후 주요 종목 뉴스,0
스튜디오드래곤   Q 영업익      억원  전년        ,0
 공시 스튜디오드래곤   분기 영업이익    억원        증가,0
 코스피 또 새역사  종가 사상최고         마감    모처럼 활짝,0
 시황  코스피          장 종료 종가 기준  사상 최고 ,0
코스피  종가 기준 역대 최고치 경신         마감,0
코스피  사상 최고치 경신 기관 외인 쌍끌이 매수,0
 마감  코스피  사상 최고가 또 경신      선  턱 밑 ,0
삼성전자       기관  조  시장 끌어 올렸다  공매도 두려움 극복 코스피 사   ,0
 코스닥 마감       올라    선 돌파 천스닥 재탈환 눈앞,0
OTT 서비스 넷플릭스만 있나  국내 사업자 경쟁력 강화 집중,0
코스닥    선 돌파   대 이상 상승,0
공매도 재개에도 새역사 쓰나 코스피      올라 장중     선,0
코스피  장중 상승폭 키워          선 등락,0
코스피 장중      상승     선 기관 외인 동반 매수,0
 사상 최고치  향하는 코스피 장중     선 돌파,0
코스피 장초반 상승     선 개인 홀로 사자,0
호텔 서울드래곤시티   무제한 망고 디저트 뷔페  프로모션 시작,0
코스피   거래일 연속 상승세     선 돌파,0
코스닥     선 상승 출발 개인 나홀로 사자,0
 특징주  스튜디오드래곤  공매도 과열종목 지정에 상승 전환,0
 K콘텐츠 플랫폼 선도하자  반격 나선 토종OTT,0
 시황  코스피 하루 만에 숨 고르기         마감,0
코스피    기술주 급락 여파에       하락,0
 시황종합  코스피       하락      마감 개인은    조 샀다,0
외인 기관  조 천 매도 폭탄 코스피   대 밀려,0
 마감  코스피  하루만에   기술주 하락에  출렁       선은 유지,0
 코스닥 마감 인플레 우려에     선 까지 하락,0
 외인 기관 팔자  코스피   대 하락     선 등락 개인은  조 샀다,0
 일흔살 발레리노  연기한 배우 고난도 발레 동작에 인공지능 있었네,0
코스피  미국  악재에     선 밑으로 개인    조 나홀로  사자 ,0
AI로 정교하게 대역 배우 얼굴 합성 몰입감과 생동감 선사,0
  기술주 급락  코스피    하락     선 SKIET  따상  실패,0
코스피    기술주 급락에 약세,0
코스닥    성장주 부진에 하락 출발     선 ,0
외국인  팔자 에     선 붕괴   CPI 따라 증시 반전할 수도 ,0
 시황  외국인  매도 폭탄  코스피     선 붕괴,0
 마감시황 코스피  외국인 매도 폭탄에 급락   삼전 한때  만원 붕괴,0
 시황종합  외인 매물 폭탄  코스피     선 후퇴    한때   만전자 ,0
코스피  외국인 이틀 연속  조원대 순매도     대로 내려앉아,0
 마감  코스피  개미  조 쓸어담았지만 하락      선으로 밀려,0
 코스닥 마감 외인 기관 매도에    넘게 하락     선 ,0
외국인  조 천억 매도 폭탄 코스피     선 뒷걸음,0
외국인 매도 폭탄 삼성전자  만원  턱걸이 ,0
CJ ENM  만능 키 로 부상한 OTT  티빙 ,0
코스피  외국인 매도 폭탄에     선서 거래,0
코스피  외인  조  매도폭탄 에   대  ,0
 외인  조 팔자  코스피    급락     선      만전자  추락 위기,0
철강 이어  차이나 플레이  수혜 다음 주자는  유통  콘텐츠 ,0
코스피    하락     선 밀려     조  팔자  vs 개인  조  사자 ,0
코스피      선 하회 외인  천억  팔자 ,0
코스피 장초반 하락     선 외국인 팔자,0
철강 이어   소비회복 수혜주는,0
코스피  외인 기관 동반  팔자 에      하락,0
 시황  코스피      선으로 추락   개인 순매수 역부족,0
 마감시황  증시 삼킨 코로나   코스피     선 하락 마감,0
 시황종합  외인 기관 팔자  코스피     선 후퇴 다시   만전자 ,0
코스피     선 마감 외인  거래일 연속 팔자,0
코스피  외국인 기관  팔자 에 장중 반락       하락 마감,0
코스피  장중      내린     선 외인 기관 동반 매도,0
외국인 기관 순매도 지속 오후에도 코스피 코스닥 ,0
코스피 외인 기관 순매도에     선 개인 나홀로  사자 ,0
코스피  장초반 소폭 오른     선 상승폭은 제한,0
 개장시황  코스피 상승세     대,0
 김정환의 맛볼까 세상 쓴맛  망고로 달콤하게 잊자  호텔 서울드래곤시티,0
 시황  외국인 매도 랠리 코스피         마감,0
 마감시황 코스피       하락 외국인  일 연속 매도,0
 코스닥 마감  기관 외국인 매도에  거래일 연속 하락     선 ,0
 시황종합  코스피     선 후퇴 한미정상회담 원전 미사일 수혜  ,0
코스피  사흘 연속 하락 마감 외인  팔자 에     선 후퇴,0
 마감시황  코스피  거래일 연속 하락       에 마감,0
코스피  외인 팔자에     선 후퇴,0
 기업성장 컨설팅  자사주 매입 소식이 끊이지 않고 있는 이유,0
    년에 무슨 일이  테이퍼닝 변수 불거질땐 이 종목에 베팅하라,0
코스피  외인  팔자 에 하락 전환   코스닥도  ,0
 코스닥 마감 개인 사자에  거래일째 상승     선 ,0
 마감시황  코스피     선 안착         상승 마감,0
K콘텐츠 세계화에 제작사 잇단 미국 진출,0
 장중시황  기관 순매수에 코스피 상승폭 확대     선 넘었다,0
스튜디오드래곤  애플TV플러스와 미드 제작    호텔 델루나 도 개발중,0
코스닥  외인 기관 팔자에 하락     선 ,0
스튜디오드래곤  애플TV플러스와   드라마 시리즈 제작,0
 STOCK  스튜디오드래곤  애플TV플러스와  미드  맞손    회당 제작비     ,0
스튜디오드래곤  미국 드라마 시리즈 제작 대신,0
스튜디오드래곤  미국 드라마 시장 진출 주목 대신증권,0
 클릭 e종목   드디어 시작된  진출 스튜디오드래곤 더 간다 ,0
스튜디오드래곤  글로벌 진출 시작 긍정적 대신,0
CJ ENM  공격적 투자와 티빙의 해외 확장  신영,0
CJ ENM   년간  조 투자  K콘텐트 허브 로,0
OECD 장밋빛 전망 코스피 장초반 외인 기관  사자  강세,0
코스피  기관 순매수에 강보합 출발,0
하나금투  CJ ENM   분기 실적 컨센서스 웃돌 것 목표가 상향 ,0
하나금투   CJ ENM  Q 실적 전망치 크게 웃돌 것    목표가     ,0
하나금투  CJ ENM   분기 호실적 전망 목표가    올려 ,0
 클릭 e종목   CJ ENM  작년말부터 이어진 호실적  Q에도 이어질 것 ,0
CJ ENM  미디어 콘텐츠 부문 실적 성장 기대 목표가   하나,0
하나금투  CJ ENM  TV광고 실적 회복에  분기 실적 예상치 웃돌 것 ,0
CJ ENM  올해 실적 사상 기대치 상회 전망 하나금투,0
CJ ENM  하반기 호실적 지속 목표주가 상향 하나,0
코스피  기관 매도에 약보합 마감 조선 자동차  강세,0
코스피  개인 외국인 매수에 보합권까지 낙폭 축소,0
 코스닥 마감  외인 매도에    선 이틀 연속 하락,0
코스닥     선 하락 전환 외인 기관 동반  팔자 ,0
CJ ENM  년간  조원 콘텐츠에 투자  글로벌 종합 엔터기업 으로 거듭난다,0
 스타애널 강성훈 DS투자증권 연구원  지누스 로  월 수익률 TOP,0
코스피      선 후퇴   외인  천억  팔자 ,0
토종과 외산 OTT 전쟁이 시작됐다,0
 주인공이 한국서 안 파는 커피사탕을   드라마 속 해외PPL 늘어난 이유,0
코스피 사흘만에 반등 외국인  서비스업종 집중 순매수,0
 코스닥 마감 외인 기관 쌍끌이    선 코앞,0
코스닥  개인 순매수에 상승 출발     선 ,0
외국인 기관 팔자에 하락 전환한 코스피,0
코스피      선 보합권 등락,0
스튜디오드래곤  애플TV  드라마 확정   시장 진출 기대 대신증권,0
애플TV  손 잡은 스튜디오드래곤   시장 진출 기대 대신증권,0
 클릭 e종목   스튜디오드래곤  미국으로 간다 ,0
스튜디오드래곤  미국 프로젝트 런칭은 외형 성장 기폭제  대신,0
 빈센조  이어  마인 에도 등장 궁금한  커피사탕 의 정체,0
