뉴스제목,주가변동
  일  코스닥 기관 순매도상위에 반도체 업종  종목,0
 소비주  국내 첫 우한 폐렴자 발생에 동반 하락,0
 코스닥 마감 나흘만에 하락  이 호재에서 악재로,0
 시황종합  코스피     선 올라    또 최고가,0
 마감시황 코스피  외국인 매수에 상승     선 회복,0
 마감  코스피  외인  사자 에     선 회복,0
코스피    넘게 올라     선    또 최고가,0
코스피     로 상승출발 코스닥은    선 머물러,0
 콘텐츠 비즈니스 강화   전문가 모시기 바쁜 IT기업들,0
코스닥  장초반 보합권 등락 실적 발표 앞두고 눈치보기,0
 마감시황  우한폐렴 에 주춤한 코스피     선 마감,0
 TF시황  국내 증시 하락 속 삼성바이오로직스  호실적에  상승 ,0
 코스닥 마감 투자 관망세에 약보합 기관 외국인  팔자 ,0
 시황종합  우한폐렴 우려 확산  코스피     선 후퇴,0
코스피  설 연휴 앞두고     선대로 후퇴 코스닥도 동반 하락,0
 마감시황  코스피  외인 기관  천억 매도하며     선 후퇴,0
코스피  외국인 기관 매도로     선서 등락,0
코스닥  외국인 기관 매도에 하락 출발,0
 개장시황  기관 외국인 매도에   코스피      선으로 하락,0
  일  코스닥 기관 순매수상위에 반도체 업종  종목,0
 마감시황  우한 폐렴  패닉셀 멈춘 코스피 강보합 마감 종합 ,0
 시황종합   신종 코로나  우려에도 코스피     선 반등,0
코스피  개인 외인 순매수에 사흘 만에 상승 마감  코스닥    선 회복,0
 마감시황  우한 폐렴  패닉셀 멈춘 코스피 강보합 마감,0
 코스닥 마감 저가매수 나선 개미덕에 상승    선 회복,0
 TF시황  코스피      대 강보합 개인 외국인  사자 ,0
 마감시황  코스피      선 방어   거래일 만에 반등,0
 오후시황  코스피     선 회복   신종코로나  우려 완화에 투심 개선,0
 신종 코로나  공포 중국 소비주 옥석 가리기,0
 시황   신종코로나  우려완화에 반등  코스피      선 유지,0
코스피     선 반등  뉴욕 증시 상승에 저가매수세 ,0
 개장  코스피  신종코로나 우려 완화 반등,0
 fn오전시황  우한폐렴 확산 속 코스피 반등,0
코스피   신종코로나  불안에도 반등 출발      대 보합권,0
 오전시황 전일 급락한 코스피  반등 출발 후 보합세,0
코스닥  외인과 개인 동반 매수에    가까이 상승 출발,0
코스피    대 하락 마감 외인 기관 IT대형주 대거 매도,0
 마감  코스피  신종코로나 공포에 급락      선 무너져,0
 마감시황 코스피  외인 기관 동시매도에 하락     선 후퇴 종합 ,0
 시황종합 신종 코로나 공포에 코스피     선 후퇴 코스닥    ,0
 마감시황 코스피   우한 폐렴  우려 지속에 하락     선 후퇴,0
 TF시황   내리막길  국내 증시 코스피      선 무너져,0
 오후시황  신종코로나 확산 우려  코스피      선  급락 ,0
 시황   신종코로나  확산 우려  코스피      선 약세,0
 개장  코스피  하락 출발      선 약보합,0
코스피 하락에     선 개장 혼조세 나타나,0
 마감시황 코로나바이러스 우려에 코스피      선까지 하락,0
 오후시황 외인 기관 매도세에 국내 증시   대 하락세,0
 신종코로나  불안에 코스피 하락 출발      선 약세,0
 개장시황  코스피  기관 순매도에 약보합 출발,0
 마감시황 사흘 만에 순매수 펼친    코스피       상승 마감 종합 ,0
 TF시황  신종 코로나 악재 끝났나 코스피     선 회복하며 반등 마감,0
 마감시황 사흘 만에 순매수 펼친    코스피       상승 마감,0
코스피  개인 외국인 매수에 반등 성공       선 안착,0
전기 전자 매집한 외국인 코스피           마감,0
 마감  개인 외국인 매수세 힘입어 코스피  나흘 만에 상승마감,0
    사자  코스피    가까이 상승     선 회복,0
 오후시황  코스피  외국인  사자      선 회복  코스닥   대 강세,0
 시황   신종코로나  우려에도 코스피    상승  장중     선 회복,0
 디즈니에서 애플 넷플릭스까지  불붙은 글로벌 콘텐츠 전쟁,0
넷플릭스도 탐내는 CJ  콘텐츠 경쟁력  프랑스판  꽃할배   태국판  너목보     ,0
코스피 개인 외국인 매수세에 상승 출발   장중     선 회복,0
 개장  코스피   신종코로나  우려에도 상승세  개인 외인 사들여,0
 마감시황  코스피 외국인 개인 매수에 반등        선 넘어,0
 오후시황  코스피      선 돌파        강세 지속,0
코스닥  개인 매수에 상승 출발    선,0
 개장시황  코스피  개인 외국인 매수세에     선 회복 출발,0
국내 증시 이틀 째  회복세    코스피지수       상승 마감,0
 시황종합     이틀째 순매수 코스피     선 회복,0
 마감시황 기침 멎은 코스피 신종 코로나 이후 첫 연속 상승 마감 종합 ,0
 코스닥 마감  경기부양 신종코로나 불확실성 혼재    선 강보합,0
 마감시황 기침 멎은 코스피 코로나 사태 후 첫 연속 상승,0
외국인  연이틀 반도체 매집 코스피       선  탈환,0
 마감  개인 외국인 매수세 힘입어  코스피     선 강보합 마감,0
 오후시황  코스피 코스닥  신종코로나 우려속 이틀째 상승세,0
코스피    경기 부양 정책에 장중     선 회복,0
 개장  코스피  신종코로나  확산 우려에도 상승세,0
이베스트   SBS  드라마부문 분사 목전 목표주가       ,0
 BTS  빅히트 상장설 모락모락  넷마블 디피씨  방긋 ,0
코스피  개인 외국인 매수로     선 상승 마감 코스닥은      턱걸이 ,0
 마감시황  코스피 이틀 연속 상승 마감      선 회복,0
 마감시황  코스피  개인 외인 매수 vs 기관 매도     선 강보합,0
코스피  외국인 매수 유입 장중     선 터치,0
코스닥  중국 경기부양 기대감에    상승 출발,0
  일  코스닥 기관 순매도상위에 반도체 업종   종목,0
 TF시황  코스피     선 돌파   고른 상승세  유지 ,0
 마감시황 코스피  기관 매수에    가까이 상승     선 회복,0
코스피  기관 순매수에    가까이 오르며     선 회복  코스닥  일 연속 상   ,0
 코스닥 마감 코로나 우려 잠잠  일만에    선 회복,0
 마감  외국인 기관 매수 힘입어  코스피     선 돌파,0
신종코로나 우려 잦아드나 코스피   거래일 만에     선 회복,0
코스피     선 탈환      급등 마감,0
 오후시황  코스피   대 상승      선 회복,0
코스피   거래일 만에 장중     선 회복  감염증 대응 기대 ,0
코스피      선 돌파 원 달러 환율     원 급락,0
 개장  코스피  거래일 연속 상승  외인 기관 사들여,0
 마감시황 신종코로나 공포 회복하나   코스피      선 회복,0
코스피       급등 마감   경기낙관론 유지,0
 마감시황  코스피  코로나 바이러스 불확실성 축소에     선 돌파,0
 오전시황 코스피 코스닥 나란히 강세        선 회복,0
 기생충 효과 에도 힘 못쓰는 CJ ENM 주가,0
 바이러스  누른  기생충    오스카 쾌거에 영화  신바람,0
 시황종합  코스피     선  턱걸이  코스닥은      상승,0
 TF시황  코스피 후퇴했지만 코스닥     p 올라  상승 마감 ,0
 코스닥 마감 이틀째 보합권 공방 개인 매수에 강보합     선 ,0
 마감시황 코스피   일째 하락 마감     선  턱걸이 ,0
 마감  코스피  이틀 연속 하락      선 후퇴,0
새역사 쓴  기생충   주식시장에서도 떠오를까,0
마이크로텍 수주공시   tvN 드라마 비밀의 숲   제작      억원  매출액대   ,0
마이크로텍 스튜디오드래곤 주식회사와    억원 계약체결,0
 개장  외인 기관  팔자   코스피      선 하락 출발,0
 코스닥 기업공시     일  서호전기 등,0
 공시  마이크로텍     억원  비밀의숲   공급계약  작년 매출      규모   ,0
마이크로텍  스튜디오드래곤과    억 규모 드라마 제작 계약,0
코스닥  하락 출발 후 강보합세 전환    선 상회,0
코스피  외국인 기관 매도에     선으로 후퇴 코스닥도 동반 약세,0
스튜디오드래곤  영업익        뚝   사랑의 불시착 만 믿는다,0
넷마블  영업이익     증가한    억원,0
옵션만기 기관 현물 매도에 발목 잡힌 증시,0
 시황종합  코스피 사흘만에 하락 코스닥은 소폭 상승,0
 잠정실적 스튜디오드래곤   년 중 가장 낮은 영업이익  매출액도 증가세 주춤     ,0
 TF시황  사흘만에 하락한 코스피     선  유지 ,0
 마감시황 코스피  기관 매도에 약보합  일 만에 하락,0
 코스닥 마감 개인 매수 몰리며 나흘째 상승    선 코앞,0
 마감  외국인 매수 우위  코스피 사흘만에 하락 마감,0
 코스닥  스튜디오드래곤     년 매출액     억원 영업이익    억원  연결   ,0
기생충 반사이익에 관련주 연일      K 콘텐츠 저변 확대 ,0
  일 장 마감 후 주요 종목뉴스,0
CJ그룹주  실적발표 마무리   카카오 KTH 등 사상 최대 실적,0
스튜디오드래곤  지난해 영업이익    억원 전년        ,0
 마감시황  코스피 사흘 만에 하락       선으로 마감,0
코스피  기관 개인 순매도에        으로 하락 마감,0
스튜디오드래곤  작년 영업익    억 전년비       감소,0
코스피  코로나   관망 심리 약보합 마감,0
 기생충  관련주 주가 연일 급등  K 콘텐츠 저변 확대 ,0
코스닥  외인 기관 매도에 하락 전환 코로나   변동성 여전,0
  일  외국인 코스닥에서 헬릭스미스           CJ ENM           ,0
  일  코스닥 기관 순매도상위에 반도체 업종  종목,0
 확진자 정점  베팅한 증시 오름세  단기 변동성 경계 ,0
 마감시황 코스피  외국인 순매수에 상승     선 회복,0
 마감  코스피   코로나    둔화에     선 회복,0
 시황종합  코스피 하루만에 반등     선 회복,0
 TF시황  코스피  외국인 매수 우위 속         마감,0
 코스닥 마감 외국인  사자 에  일째  오름세     선 근접,0
스튜디오드래곤  사랑의 불시착  효과 톡톡,0
CJ ENM 스튜디오드래곤  실적부진에 주가 동반하락,0
 사랑의 불시착  스튜디오드래곤  해외 매출 비중    이상 끌어올린다 ,0
 개장   코로나    확산 우려  코스피      선 출발,0
 스튜디오드래곤  이민호 김수현 나올  분기부터 반등 기대 ,0
스튜디오드래곤  지난해 부진 털고 실적증가 전망 대신,0
 스튜디오드래곤  K콘텐츠에 우호적 여건 목표가   IBK투자증권,0
코스피  외국인 IT 매수      상승 마감,0
코스피  외국인 매수에         상승 마감 코스닥도 상승,0
중국 코로나   확진자 급증에 코스피      대 하락 출발,0
코스닥     코로나    급증 소식에 보합권으로 출발,0
 사랑의 불시착  흥행에도 제작사 주가는 ,0
 한국적인 것이 세계적인 것   봉준호 신드롬  이제 시작이다,0
숨 고르는 코스피 경기민감주 눈여겨 봐야,0
 마감시황 코스피  글로벌 경기 둔화에 하락 마감,0
 마감시황 코스피  글로벌 경기 둔화에 약보합 마감,0
 TF시황  코스피 반전 거듭하다     선 하락 마감,0
 코스닥 마감  개월만에    선 회복 BTS 관련주  강세 ,0
 시황종합  코스피     순매도에 약보합  일부 IT 차익실현 ,0
 마감  코스피  외인 매도에     선 약보합 마감,0
 기생충  오스카 수상 문화산업적 의미    한국 엔터테인먼트 산업에 대단한 기회   ,0
 개장  코스피  외인 기관    억대  팔자 에 하락세,0
 봉 감독 차기작은 언제   기생충  투자바람 부는 여의도,0
 마감시황  코스피  개인 기관 매수 vs 외인 매도 약세,0
코스닥  시가총액 상위  주도에 상승 전환    선 진입,0
숨고르기 들어간 코스피 약보합 출발,0
코스닥  하락 출발 외인 기관 동반 매도세,0
 개장시황  코스피 하락 출발        선으로 하락,0
 증시브리핑   증시  코로나   불확실성 소비지표 실망감 다우 약보합,0
IT 주도주 흐름 변화 없어  차전지는  장기전 ,0
 마감시황 코스피  국내 코로나   확진자 급증에 상승 폭 제한,0
 코스닥 마감 코로나   우려 누른 외국인  사자  소폭 상승,0
 시황종합  코스피   코로나   우려  불구 강보합 외인은 순매도,0
 TF시황  코스피 개인 매수 속     선 상승 마감,0
 마감시황  코스피 강보합세로 장 종료   코스닥도 상승 마감,0
코스피 개인 매수세에        로 상승 마감,0
 시그널  CJ ENM  덱스터 김용화 대표 지분 일부   억원에 인수,0
 마감  코스피  개인     억원대 사들여  강보합세,0
CJ ENM 영광 뒤 수익성 회복 관건,0
코스피   코로나    확진자 급증에 하락 전환     선 내줘,0
 개장  코스피  기관 매수에 상승      선 회복,0
코로나  에 울고 웃은 코스피 강보합 마감,0
코스닥  코로나   확진자 대폭 확대에    선으로 후퇴,0
코스닥  상승 출발  전날 낙폭 일부 회복,0
 마감시황 코로나   확진자 급증 다시 무너진     선,0
 시황종합  코로나 우려   코스피     선 후퇴 환율  개월  최고,0
 TF시황   코로나    우려에 코스피     선으로 후퇴,0
 마감   코로나    확진자 급증에  코스피      선 붕괴,0
코로나  에  화들짝  코스피    거래일만     선 붕괴,0
 코스닥 마감 코로나   확진자 급증으로 하락       턱걸이,0
코스피  장중     선 붕괴 원 달러 환율    원 ,0
연상호 작가  방법  프랑스  시리즈 마니아  러브콜,0
 개장  코스피  외국인 매수 힘입어 상승      선 회복,0
 스튜디오드래곤  올해 매출 증가 기대 ,0
스튜디오드래곤  작년  Q 실적 기대 이하 올해는 기대 현대차,0
현대차   스튜지오드래곤  작년  분기 컨센서스 하회 ,0
코로나   확산      선 깨진 코스피,0
 fn마감시황  코스피  기관 매도에 약세로 마감,0
 마감시황      선 무너진 코스피 하락 마감   코스닥도 하락 마감,0
코스닥      선으로 하락 전환 코로나   확진자 급증에 위축,0
 오후시황  코로나   확진자 급증   코스피      선 아래로,0
코스닥  강보합 출발    선 상회,0
 개장시황  코스피 상승으로 장중      선 회복   외국인 기관 순매수,0
스튜디오드래곤  중장기적으론 긍정적 현대차증권,0
 마감시황 내리막길 타는 코스피 확진자 급증에   대 하락 종합 ,0
 마감시황 내리막길 타는 코스피 확진자 급증에   대 하락,0
코로나 공포감 확산 코스피   대 하락,0
 시황종합  코로나 공포  코스피     대  뚝  환율  개월  최고,0
 코스닥 마감  코로나    파랗게 질린 코스닥    대      선 ,0
 TF시황  코스피 기관매도 속 이틀째 하락     선 마감,0
 마감   코로나    확산 우려  코스피      선 하락 마감,0
코스피  코로나   급속 확산에   대 하락 환율  개월  최고,0
카카오페이지 CJ ENM  제 회  추미스 소설 공모전  개최,0
 개장  코스피  기관  팔자       선 하락 출발,0
카카오페이지  CJ ENM과 추리 미스터리 스릴러 소설 공모전,0
추리  미스터리 스릴러를 섞어라  카카오페이지 제 회 추미스 소설 공모전,0
 마감 시황  코로나   확산 속 코스피      로 급락,0
코스피  코로나   확산에 하락세 출발 장중      대로 후퇴,0
코로나  에 감염된 코스닥  하락 출발,0
 마감시황 코스피  하루만에     선 회복 반발 매수세 유입 종합 ,0
 시황종합   급락에도 코스피     선 회복 불안한 반등 ,0
 마감시황 코스피  하루만에     선 회복 반발 매수세 유입,0
 TF시황  나흘만에 회복세 탄 증시     선 마감,0
 마감  개인 기관 매수세 힘입어  코스피      선 회복,0
코스피  하루 만에     선 회복  저가매수 추경기대 원화강세 ,0
 개장  코로나   확산 우려  코스피      선 출발,0
한숨 돌린 코스피 하루 만에      선 회복,0
 오후시황 증시 상승 전환   코스피      선 육박,0
코스닥  코로나   확산 진정에   대 회복,0
 오전시황 코스피 소폭 상승세   급락세 진정,0
코스닥  코로나   악재 다 반영됐나  나흘만에 상승 출발,0
 개장시황  코스피  외국인 매도 속     선 약보합 출발,0
 마감시황 코스피     하락     년 개월만에 최대 매도 종합 보 ,0
 TF시황  코로나   확산 우려 속 코스피   대 하락,0
코스피       선 또 붕괴 외인  천억 이상 순매도,0
 마감시황 코스피  코로나   지속 확산 우려에   대 하락 종합 ,0
 시황종합 코스피     선 후퇴     일간  조 넘게 팔았다,0
 코스닥 마감 코로나   팬더믹 우려에 약보합    선,0
 마감시황 코스피  코로나   지속 확산 우려에   대 하락,0
 마감  외인  팔자  행진  코스피      선 마감,0
 개장  외인  팔자  기조에 코스피      선 하락 출발,0
코스닥  코로나   우려 여전  낙폭 축소,0
 오후시황 코로나   우려에        선으로 내려 앉은 코스피,0
코스닥  코로나   글로벌 확산 우려에    하락 출발,0
뉴욕증시  악재 외국인 매도에     선 아래로,0
금리 동결에 실망한 코스피 외인 나흘동안    조원 매도,0
 마감시황 코스피  한은 금리 동결에 실망 매물 출회        종합 ,0
 시황종합  예상밖 금리동결  코스피     선 밀려     일째 팔자,0
 TF시황  코스피 이틀째 급락     선으로 후퇴,0
 마감시황 코스피  한은 금리 동결에 실망 매물 출회       ,0
 마감  코로나   금리동결  코스피      선 마감,0
코스피    대 하락 한은     분기 마이너스 성장 가능성 ,0
 SC 글로벌 브랜드  CJ ENM  한 미 콘텐츠 회사 지분 투자 및 파트너십    ,0
 신중한 한은에 실망  코스피 낙폭확대 코로나  에도 금리  동결 ,0
코스피  한은 기준금리 동결에 하락 전환 코스닥도 내리막,0
 오전시황  외인  일 연속 매도에도   코스피 전장 대비 강세,0
 개장  외인 기관  팔자   코스피      선 출발,0
코스피  기준금리 동결에 장중     선도 붕괴 코스닥   대 하락,0
코스닥  개인 매수에    선  강보합  출발,0
 개장시황  코스피  외국인 기관 매도에 약보합 출발,0
 마감시황 코스피 나흘째 오르며      선 넘어서,0
 TF시황  코스피 개인 매수 우위 속     선 마감,0
이틀 연속 상승 코스피       오르며     선 안착,0
 마감시황 코스피  나흘째 상승 마감     선 회복,0
 마감  개인 매수세 힘입어  코스피      선 상승마감,0
 코스닥 마감 개미의 뜨거운 러브콜    선 회복,0
주총 시즌 개막   코로나   사태에  전자투표  바람,0
코로나  가 앞당긴 주총 전자투표,0
 오후시황 코스피 코스닥 오후 들어서도 강세,0
주총 눈앞 유통가도 비상   장소 변경 등 대응책 고심,0
하남돼지집  드라마  하이바이  마마   제작지원,0
코스피 장중     선 안착     선도  터치 ,0
CJ그룹   개 상장 계열사 모두 전자투표제 도입 완료,0
CJ그룹  주주친화경영 속도 전 상장사 전자투표제 도입,0
CJ그룹   개 상장 계열사에 전자투표제 도입,0
 마감시황 코스피  미 증시 훈풍  일째 올라     대 회복,0
위험자산 심리 회복 코스피           마감,0
 기업  CJ그룹   개 상장 계열사 전자투표제 도입 완료,0
CJ그룹  전 상장 계열사에 주총 전자투표제 도입,0
 개장시황  코스피      P대 상승 출발 개인만  사자 ,0
 마감시황 코스피  외국인  팔자 에   대 하락 종합 ,0
 TF시황  코스피   대 내려     선  마감 ,0
 마감시황  코스피  외국인  팔자 에   대 하락,0
 시황종합  코스피          선 후퇴 외국인 기관  팔자 ,0
 마감시황  외인 기관  팔자 에 코스피    하락 마감,0
 코스닥 마감 외인 기관 동반 매도에   대 하락     선 ,0
 마감      억 개인 매도세 불구  코스피   대 폭락       마감,0
코스피  외국인 매도에    넘게 하락 환율 급등,0
 오전시황  코스피  개인매수     억대 불구   대 급락 중,0
 개장  미국증시 큰폭 하락 영향에  코스피    폭락 출발,0
주총 시즌 개막  코로나 사태에  전자투표  바람,0
 코로나   팬데믹  공포에 코스피       하락 마감,0
코스피  미국 증시 급락 여파에   대 하락,0
코스닥  코로나    경기 둔화 우려에 낙폭 커져,0
코스피      하락 출발 장중      대 후퇴,0
코스닥  외인 기관 동반 매도세에    가까이 하락 출발,0
 마감시황 개인 기관 쌍끌이 매수에  일만에 반등 종합 ,0
코스피     선 회복   외국인   조원  팔아,0
 마감시황 개인 기관 쌍끌이 매수에 코스피  일만에 반등,0
 시황종합   증시 폭락에도 코스피 반등 환율   원 급락,0
 TF시황  코스피 기관매수 늘며     선  마감 ,0
뉴욕증시 급락에도 코스피 강보합 외국인은 또   조  매도,0
코스피  개인 기관 매수에 사흘만에 반등 성공       선 회복,0
 코스닥 마감   부양책 기대감에 사흘만에 상승,0
 마감  종일     선 등락 코스피          기관 매수     억대,0
 시황  외인  팔자  기관  사자   코스피      선 등락,0
코스피 장중 한때     선까지 내려가 코스닥    하락세,0
 개장  개인 외국인 순매도  코스피     선 하락 출발,0
코스피    증시 폭락에도 소폭 하락  먼저 맞았다 ,0
코스닥    감세안 등에 장중 상승 전환,0
  증시 유가 폭락에 코스닥   대 하락 출발,0
 폭락  코스피     선  년래 최저,0
코스피 장중     선 붕괴  시총 하루만에   조원 증발,0
 시황종합 코스피       한때     선 붕괴 코스닥    선 무너져,0
코스피 장중      붕괴  코로나 불안  외국인 팔자행진,0
 TF시황  코스피 장중     대 무너져         마감,0
 마감시황 코스피      선 턱걸이   년 최저  코스닥    선 깨져 종합 ,0
 마감시황 코스피   년 최저     선 턱걸이 코스닥    선 깨져,0
 마감  코로나   팬데믹 우려 속  롤러코스터  코스피    대 폭락,0
 코스닥 마감       하락  개월만에    선 붕괴,0
외국인  나흘간  조 팔았다   코스피      선도 위태,0
코스피 장중    하락에     선 위태 코스닥    선 깨져 종합 ,0
코스닥  장중      하락   개월만에    선 붕괴,0
코스피  외인 매도 공세       선까지 후퇴,0
코스피     선 상승 개장 보합권서 등락 반복,0
코스닥    대 낙폭 확대  개월 만에    선 붕괴,0
코스닥  외인 기관 매도세에 낙폭 확대    선도  흔들 ,0
코스닥   급여세 인하 제안에도 약보합 출발,0
 마감시황 코스피   년여만에 사이드카    급락  패닉  종합 ,0
코스피     선도 깨질뻔했다 트럼프 대책 실망에 사이드카 발동,0
 마감시황  코스피  이틀째 폭락     대까지 추락,0
 TF시황  국내 증시  팬데믹  충격 코스피     선 마감,0
 마감시황 코스피   팬데믹 충격 에      폭락   사이드카 발동,0
트럼프 실망매물  속출    코스피       선으로  속락 ,0
 마감시황 코스피   년여만에 사이드카     급락  패닉 ,0
WHO 늑장 대처에  증시 패닉  코스피  사이드카  덕에     선 사수,0
 마감  팬데믹 쇼크에 사이드카 발동까지 코스피   대 폭락,0
 코스닥 마감 트럼프 말발도 안 먹혔다  개월만에    선 붕괴,0
팬데믹 선언에 새파랗게 질린 국내 증시 코스피      폭락 마감,0
 종합  트럼프에  뺨 맞은  코스피 장중       폭락,0
코스피  장중   대 하락해     선 무너져 한때    급락,0
코스피       선 붕괴  출발 초반      밑에서 거래,0
코스피  WHO 팬데믹 선언에     선 재붕괴 외국인 엿새째  팔자 ,0
 팬데믹  선언에 코스피도 털썩 장중     선 붕괴,0
 개장  코스피     선 무너지며 출발     가량 급락      선 ,0
코스피       폭락 장중      도 무너져 사이드카 발동,0
 속보 코스피  트럼프 대통령 연설 실망감에 낙폭 확대   대 급락,0
코로나 팬데믹 공식화 코스닥    선도 무너져,0
  일  외국인 코스닥에서 셀트리온헬스케어          에이치엘비          ,0
  일  코스닥 기관 순매수상위에 반도체 업종  종목,0
 마감시황 코스피    년 최저     선 붕괴 코스닥은    선 밑으로 종합 ,0
금융시장 또  출렁  주가 원화   년만에 최저 종합 ,0
 종합 보   년 전으로 돌아간 증시 코스피    거대 부양책에도     선 붕괴,0
 마감시황  코스피     넘게 추락     선마저 붕괴,0
 마감시황 코스피    년 만에 최저     선 붕괴 코스닥은    선 밑으로,0
 시황종합  코스피   년만에     선 붕괴 코스닥도      ,0
