뉴스제목,주가변동
스튜디오드래곤  독보적 IP 창조 활용 역량 보유 키움증권,0
스튜디오드래곤  글로벌 제작사로 거듭날 것 키움,0
  일  기관 코스닥에서 동화기업          브이원텍        등 순매수,0
 마감시황 코스피      선 돌파 후 연속 상승  개인이 이끈다  종합 ,0
 TF시황  코스피  개인 수급에 강보합     선 마감,0
 마감시황 코스피  연속 상승에     선 안착,0
 마감시황 코스피  동학개미 매수세에      대 안착,0
 코스닥 마감 차익매물 출회에    선 기관 외국인  팔자 ,0
코스피 강보합     선 공방 조선  강세,0
 fnRASSI 스튜디오드래곤        오르며 거래량 증가,0
 개장  코스피  미 중 갈등 우려에     선 하락  기관 순매도중,0
스튜디오드래곤  미디어 난항 속 해외 수요 지속 SK,0
SK   스튜디오드래곤  업종내 실적 안정성 부각 ,0
같은 업종에서도 울고 웃고 코로나가 가른 주가 희비,0
코스피  미중 갈등 고조 속 강보합 전인대 폐막  관망 ,0
코스피  소폭 하락 숨고르기 SK 포스코 강세,0
코스닥     선서 하락출발 외국인 기관  팔자 ,0
코스피  외인 기관 매도세에        으로 하락 출발,0
스튜디오드래곤  넷플릭스 공급 등 해외 모멘텀 부각 SK증권,0
 I 리포트  스튜디오드래곤  실적 안정성으로 업종 내 부각 SK ,0
몸 낮춘  성급 호텔  반값 세일에     박 더 까지,0
 마감  경제성장률        코스피      선대로 밀려,0
 시황종합  코스피 약보합     선 코스닥   대 하락,0
 TF시황  코스피  개인 매도 커지며     선으로 후퇴,0
 마감시황 코스피  역성장 공포에 하락,0
 코스닥 마감 미중 갈등 우려에 이틀째 하락     선은 지켜,0
역성장 전망 미중갈등 격화   코스닥      ,0
코스피 하락 전환     선 코스닥    하락,0
코스피 장중 한때     선도 넘어 반도체  상승,0
 개장  외국인이 돌아왔다  코스피      선 돌파,0
코스닥 시총  춘추전국시대 ,0
 TF시황  외인 기관 매수 코스피     선  탈환 ,0
 코스닥 마감 나흘만에 하락하며 숨고르기    선 하회,0
기관 순매수       역대급  코스피    오르며      마감,0
 마감  코스피     일 만에     선 회복  외인 기관 주도했다,0
 시황종합 V자 반등 코스피 석달만에     선 회복       급등,0
코스피    급등     선도 넘어 삼성전자    올라,0
미래에셋대우  스튜디오드래곤  글로벌 OTT 수요 확대 수혜 ,0
코스피     일만에 장중     선 회복   기관  사자 ,0
 개장  미국발 훈풍에 웃는 코스피       돌파,0
미래에셋대우    물들이는 한드 스튜디오드래곤  매수  유지 ,0
 스튜디오드래곤   드라마 글로벌 OTT 수요확대  미래에셋대우,0
스튜디오드래곤  글로벌  한드 사랑 은 굳건 미래에셋대우,0
 마감시황 코스피  석달반 만에     선 탈환  거래일 연속 상승,0
코스피  장초반   대 급등 뒤 상승폭 내줘     선 등락,0
코스피     올라     선 반도체  상승 이어가,0
 개장  코스피   대 급등 출발  장중     선 탈환,0
  일  기관 코스닥에서 스튜디오드래곤          비에이치         등   ,0
 마감  코스피   거래일 연속 상승      선 턱밑,0
 TF시황   거래일 연속 상승 코스피     선 안착,0
 마감시황 코스피   거래일 연속 상승 행진     선 마감,0
 시황종합  코스피     선 눈앞 코스닥도 강보합 마감,0
 거래일 연속 오른 코스피    일만에      선 탈환,0
 주식 초고수는 지금 부광약품 카카오 집중 매수   스튜디오드래곤  팔자 ,0
 개장  코스피 숨 고르기  개인 외국인 매도에     대 보합,0
신한금투  스튜디오드래곤   더킹  인기에 실적상승 기대 ,0
    년 차 화 정 랠리와  닮은 듯 다른  국내 증시,0
 극장 관련   밸류 매력 높아 흥행 산업 의외성 ,0
국내도  줍줍  열풍 LG화학 스튜디오드래곤 뜬다  나스닥  만 시대  수혜주를    ,0
코스피  기관 매수세에 힘입어 상승 반전,0
코스피  개인 외국인 매도세에        로 하락 출발,0
 스튜디오드래곤   더킹  흥행에 해외 판권 매출 극대화  신한금융투자,0
 마감시황 코스피   네 마녀의 날  맞아 열흘 만에 하락 종합 ,0
 웨이브  가입자     만 육박 몸값 뛰는 콘텐츠 ,0
 TF시황  코스피   거래일 만에 하락     선 후퇴,0
 마감  코스피   일만에 하락  기관 외국인 동반  팔자       선 후퇴,0
 시황종합  코스피     선으로 밀려 코스닥도 약보합 마감,0
 코스닥 마감 연중 고점 부담감  일 만에 하락,0
 마감시황 코스피   네 마녀의 날  맞아 열흘 만에 하락,0
 주식 초고수는 지금  셀트리온  형제  매수 치열    셀트리온제약 젬백스  팔   ,0
    만명 가입자 앞둔 SK텔레콤  웨이브   콘텐츠주 지금 살 때 ,0
 TF시황  외인 기관 동반 매도 코스피     선 마감,0
 마감  조정장세 들어간 코스피      선으로  후퇴 ,0
 마감시황 코스피    증시 폭락에     선 후퇴,0
 코스닥 마감 개인 기관  팔자 에            선 ,0
 시황종합  코스피    하락     선 밀려  차 팬데믹 우려,0
 증시    급락에도 선방한 코스피    내린     에 마감,0
코스피     선 밀리고 코스닥   대 하락률   뉴욕 증시 급락 영향,0
오락 문화업         이 약세인 가운데  코스닥도 하락 흐름         ,0
 개장       넘보던 코스피  뉴욕증시 폭락에     뚝 ,0
코스피     급락 출발 후     선서 공방,0
영업이익    억원 이상 강소기업   폐기물 처리업체 영업이익률    대 조선기자   ,0
스튜디오드래곤  동남아 해외판권 서프라이즈 기대 한화,0
 부부의세계  제이콘텐트리  물적분할 승부수 주가 상승 호재 ,0
  머니 주요산업 증시기상도  정부 백신개발 지원 시동 제약바이오  옥석 살펴야,0
코스닥    폭락에 개인  팔자    대       선,0
스튜디오드래곤  동남아 해외 판권 실적 기대감 한화투자증권,0
스튜디오드래곤  동남아 등 해외 판권 가격 상승 가능성,0
  일  코스닥 기관 순매수상위에 반도체 업종  종목,0
  일  코스닥 외국인 순매수상위에 화학 업종  종목,0
 언택트 수혜  미디어  더 갈까  무형자산 비중 따져라,0
 TF매매동향  외국인   삼성전자 사고  신한지주  팔았다,0
 빅사이클  진입한 미디어  OTT 경쟁에 웃는다,0
 TF시황  국내증시 종일  혼조  보합권 마감,0
 마감시황 코스피  대북 리스크에도 침착     선으로 강보합 마감,0
 마감  북한 리스크에도 주식 담은 개미  코스피 추락 없었다,0
코스피 코스닥  코로나   재확산 한반도 안보 우려에도 보합권 마감,0
 시황종합  코스피 코스닥 강보합 마감   리스크 제한적 ,0
 코스닥 마감   긴장 고조  호조 혼재에 보합,0
대북 리스크 빗겨간 국내증시 코스피       선 안착,0
코스피 코스닥 보합권 등락 개인 사고    팔고,0
코스피 코스닥 상승 전환   리스크 제한적,0
 개장  코스피  북한 도발에 주춤      선 약보합,0
스튜디오드래곤  하반기에도 끊임없이 풍부한 볼거리 대신,0
 개장시황  코스피  북한발 리스크 제한적 소폭 하락,0
 I 리포트  스튜디오드래곤   분기 호실적 전망 대신증권,0
스튜디오드래곤   Q 호실적 지속 전망 대신증권,0
 코스닥 마감 미 중 무역협상 노이즈 딛고 소폭 상승,0
 마켓인사이트   년 IPO 베테랑이  리츠시장 도약  자신하는 이유,0
코스피     이상 오르며     선 회복  코스닥    선,0
명품 직구하다 사이즈 안맞아 되팔려 창업  커버낫  대박에 매출    억 회사 대   ,0
   무역합의 끝났다  발언에 코스닥 하락 반전,0
코스닥    대 상승 출발 개인만  사자 ,0
증권사      리포트   어떤 내용 담겼길래 ,0
새빨간 표지에    세 미만은 시청 불가  증권사 리포트 왜 ,0
 코스닥 마감 개인 외인 사자에  일째 상승    선 바짝,0
 무슨 내용이길래  여의도 증권가    금 리포트  화제,0
DB금투  스튜디오드래곤   분기 실적 양호 기대 ,0
 호텔 델루나  미국서 리메이크    스카이댄스와 첫 프로젝트,0
코스닥  개인 사자에 상승 출발     선,0
 마감시황 코스피  개인 외인 쌍끌이 매수에 하루 만에 반등,0
 TF시황  국내증시  개인 외인 동반 매수에  상승 ,0
 마감  코스피      선 회복  개인 외국인 쌍끌이 매수     ,0
코스피  하루 만에 반등   증시 강세에 투자심리 개선,0
 시황종합  코스피    올라     선 코스닥 강보합,0
 코스닥 마감 하루 만에 강보합  통신장비  급등,0
코스피   대 올라     선 삼성전자    상승,0
코스피     볼커 룰  완화 소식에 반등      선 탈환,0
코스닥  장중 하락 전환  시가총액 상위  ,0
  증시 훈풍에 코스닥   대 상승 출발,0
한한령 공식 해제 관측에 활짝 핀 중국 소비주,0
한한령 해제 기대감 타고   소비 관련   얼쑤 ,0
한한령 해제 기대감에   소비  날았다,0
 TF시황  코스피  기관 매수에  상승      선 마감,0
  한한령 해제 기대감에 화장품 등 중국소비  급등 종합 ,0
 마감시황 코스피  기관 매수 힘입어     선 회복,0
 마감  코스피     선 안착  기관  사자 가 살렸다,0
 마감시황  하루만에      선 돌아온 코스피,0
 시황종합    훈풍  코스피     선 회복  소비  강세,0
기관이 버틴 코스피  하루만에     선 회복,0
 코스닥 마감 한한령 해제 기대에 소폭 상승    선 바짝,0
코스피   훈풍에      상승     선 회복 외국인 기관  사자 ,0
 오후 주식시장은  코스피   대 근접한 상승세   대형 반도체주 강세,0
 STOCK  스튜디오드래곤  한한령 해제  분기 호실적 기대감에  강세 ,0
 fnRASSI 스튜디오드래곤    주 신고가          ,0
한한령 해제 기대에 JYP SM 초록뱀 YG 키이스트 코리아나 한국콜마 아모레퍼시   ,0
 스튜디오드래곤    주 신고가 경신  더 킹  드라마 군주   DB금융투자  B   ,0
코스피  기관   거래일만에 순매수      회복,0
코스피  미 중 갈등 우려에도 상승 마감     선 회복,0
화장품 면세점 카지노 엔터까지 중국 관련주 간만에 날았다,0
  일  코스닥 기관 순매수상위에 오락 문화 업종  종목,0
주가 올렸던 개미들  횡보장서도  줍줍   돈 더 들어온다 ,0
 마감시황 코스피 하락 마감        선 아래로,0
 TF시황  외인 기관 매도에 코스피     선  후퇴 ,0
코스피 소폭 하락한     로 마감,0
 마감시황 코스피  외국인 기관  팔자 에 소폭 하락,0
 마감  코스피  외국인 기관 순매도에     선으로 후퇴,0
 시황종합  코스피     선으로 밀려   코로나   확산 영향,0
코스피  외국인 기관 순매도에 하락마감      선 후퇴,0
코로나지만 괜찮아 넷플릭스 따라 스튜디오드래곤 달린다,0
 오후 주식시장은 코스피는 하락 전환  코스닥은 오름폭 키워,0
 fnRASSI 스튜디오드래곤            주 신고가 경신            ,0
 스튜디오드래곤    주 신고가 경신  보수적으로 반영해도 레벨업   한화투자증권   ,0
 특징주  CJ ENM  실적 상승 기대감에 상승세,0
코스피  장중 하락전환     선으로 코스닥도 약보합,0
 개장  코스피  경기 회복 우려에도 소폭 상승      선 터치,0
잠잠한 코스피 소폭 오른     으로 출발,0
   금  콘텐츠가 한국 드라마 경쟁력 키운다,0
씨젠   주 신고가 잡히지 않는 팬데믹에 제약 바이오 강세,0
코스닥  개인 외국인  사자 에 상승 출발     선 ,0
  일  기관 코스닥에서 셀트리온헬스케어          아미코젠            ,0
  일  코스닥 외국인 순매도상위에 통신장비 업종  종목,0
SK바이오팜 상장 효과에 공모주 펀드  수익률     P  껑충 ,0
 TF시황  개인이 상승 주도한 국내증시 코스피     선 마감,0
 코스닥 마감 한국판 뉴딜 기대에    선  년 개월 최고,0
개인 순매수세에 코스피     선  상승 마감  코스닥    올라,0
 시황종합  코스피 소폭 올라     선 SK바이오팜 첫 하락,0
 마감  개인  사자 에 코스피  소폭 상승      선 눈앞,0
 마감시황 코스피  옵션만기일 맞아 변동성 장세,0
실적 성장 기대 목표주가 높아진 기업은,0
실적 개선 기대감 목표주가 높아진 기업은 ,0
 개장  코스피  미국 증시 훈풍에 상승      선 돌파,0
 Hot Line   CJ ENM  스튜디오드래곤과 시총 역전은 매수 기회 ,0
코스피   증시 훈풍에 상승 카카오 시총   조 돌파,0
코스피   일만에 상승 개인 홀로 순매수,0
코스닥   증시 훈풍에 상승 출발     선 ,0
CJ ENM  업황 회복 구간서 상승 탄력 강할 것 한투,0
CJ ENM  업황상승시 강한 탄력 전망  한국투자증권,0
  일  기관 코스닥에서 씨젠           셀트리온헬스케어         등   ,0
한국투자증권  리서치 챌린지 대회 개최,0
한국투자증권   제 회 리서치 챌린지  시상식 개최,0
 TF시황  코스피  개인  조 샀지만  하락      선 마감,0
 마감시황 코스피  미 코로나 확산 우려에      하락,0
코스피  국제증시 혼조세에 동조해 하락마감,0
 코스닥 마감 코로나 확산에 사흘 만에 약보합,0
한국투자증권   제 회 리서치 챌린지 시상식  개최,0
한국투자증권  제 회 리서치 챌린지  시상식 개최,0
증시  큰 손  코스닥시장서 미디어 엔터   찜 ,0
코스피  장초반 하락     선 코스닥은 등락,0
 개장  코로나   재확산 우려 vs 온라인매출 기대  코스피 향방은 ,0
  일 장 마감 후 주요 종목뉴스,0
장 마감 후 기업공시  월   일 ,0
스튜디오드래곤   월  일  분기 실적 발표,0
코스피  기관 외국인  조 매물    가까이 하락,0
코스피  경기회복 지연 우려에 하락 NAVER 시총  위 등극,0
코스닥   코로나 확산 에 혼조  보합권 출발,0
 TF시황  코스피  외인 기관 매수에     선  회복 ,0
 마감시황 코스피       상승해     선 회복,0
한드 맛집  스튜디오드래곤   한한령 전화위복,0
JYP엔터  콘서트는 못하지만 신인  한한령 해제가  위안 ,0
또 연고점 코스닥  개월새     넘게 가파른 반등,0
한한령 해제 기대감에 수혜주 눈길 콘텐츠주 엔터주 껑충 다음은 화장품 ,0
 개장  코로나   백신 기대감에  개인  사자  행렬  코스피  ,0
코스피  코로나 치료제 개발 기대감에      선 직행,0
 이진우의 주간증시  시장 띄우는 미 중 한 지금은  이기는 말에 돈 걸어라  ,0
코스피 코스닥 개인 매수세에 상승 출발,0
코스피  개인 매수세에     선 회복,0
  일  코스닥 기관 순매도상위에 반도체 업종  종목,0
 itM 마감시황  코스피  외국인 기관  팔자 에 약보합         마감,0
 TF시황   하락 곡선  국내 증시 코스피      선 유지,0
 마감  미중 갈등 재점화  코스피     선  약보합 ,0
코스피  외국인 기관 순매도세에 하락 마감      선 유지,0
 마감시황 코스피  외국인 기관 동반 매도세에 약보합 마감,0
   조  한국판 뉴딜  훈풍 수혜주 어디 ,0
   조 투입 한국판 뉴딜 투자  선택 아닌 필수  수혜주 들썩,0
 개장  미국 증시 혼조에 코스피 하락세로      선 등락,0
 itM 개장시황  코스피  기관  팔자 에 약보합 환율       원 출발,0
 Hot Line   스튜디오드래곤   분기 코로나에도 실적 성장 예상 ,0
 클릭 e종목   Q영업익 전년       스튜디오드래곤  고공행진 ,0
스튜디오드래곤  독보적인 콘텐츠 제작 능력으로 성장 담보  키움,0
스튜디오드래곤  올해  분기에도 성장 지속 목표가  유지  키움,0
스튜디오드래곤  성장성 확인 키움증권,0
  일  기관 코스닥에서 EDGC           셀트리온헬스케어           ,0
 개월만에      회복한 코스피  반도체 등 대형주 공략 ,0
 코스닥 마감 이틀 만에     선  탈환  년 개월 최고,0
 마감  코스피   개월 만에     선  코로나   백신 기대감,0
 TF시황  코스피  외인 기관 동반 매수에     선 마감,0
코스피   개월 만에      선 안착 코로나   백신 개발 기대감,0
 개장  코스피      선 안착  기관  사자 에 상승세,0
코스닥  분기 실적  희비  예고,0
 마감시황 코스피  백신 소식에  개월 만에     선,0
CJ ENM  프듀 조작  문책인사    신형관 본부장  아이랜드  TF행,0
 코스닥 마감 외국인 기관  팔자  다시    선 하회,0
 마감시황 코스피      선으로 후퇴 기관 외인  팔자 ,0
 마감  기관 외국인 동반  팔자   코스피      선 깨져,0
 itM 마감시황  코스피  외인 기관 차익실현에     선 반납,0
 개장  코스피      선 지키기  안간힘 ,0
 itM 개장시황   증시 강세 효과  하루 뿐  코스피 보합세 출발,0
스튜디오드래곤   시청률 낮아도 괜찮아    한한령 해제시 최대 수혜 하이투자,0
 마켓인  미디어 블루오션 잡자  뭉칫돈 몰리는 OTT,0
코스피  상승 동력 소진에      선 하루 만에 반납,0
코스피  장 초반 보합세     선,0
 스튜디오드래곤   분기 큰 폭 실적 개선 기대  하이투자 ,0
스튜디오드래곤  드라마 성공으로  분기 깜짝 실적 하이투자증권,0
 BTS월드  개발사 테이크원컴퍼니   예비 유니콘 특별보증  선정,0
 코스닥 마감 외인 기관 쌍끌이에    선 돌파  년  개월 최고치,0
코스피  미 중 갈등에 하락 마감 코스닥은  년 개월만    선 회복,0
연고점 찍은 코스닥   년 개월 만에    선 돌파,0
코스닥  하락 출발 외인 기관 동반 매도     선 ,0
또 다시 요동치는 코스닥 시총 상위주,0
증권가를 뒤흔든    금  리포트  참신함이 던진 일침,0
 특징주  가상 증강현실   정부 규제혁신 발표 소식에 강세,0
 언택트로 OTT 뜨니 한류 타고 하반기  K콘텐츠  난다 ,0
 시그널  카카오M  바람픽쳐스 인수    나의 아저씨   나올까,0
 엔터비즈 스튜디오드래곤   분기 역대 최고매출 달성  사랑의 불시착  등 글로벌   ,0
스튜디오드래곤  분기 역대 최고 실적 달성  사랑불   더킹  덕 호실적,0
 마켓인사이트  부부의세계  제작사 JTBC스튜디오 투자유치  네이버도 참여 검토,0
스튜디오드래곤  분기 영업이익    억  역대 최고 실적,0
게임기 대신 노트   사요 베일벗은  갤럭시 오형제  총정리,0
 일 장 마감 후 주요 종목뉴스,0
 갤럭시노트    삼성의 구원투수될까  갤럭시언팩      ,0
스튜디오드래곤   분기 영업익    억원 전년대비     ,0
스튜디오드래곤   Q 영업이익      억 전년비       ,0
콘텐츠  너무 얕봤나 예상 웃도는  실적 선전 ,0
 마감시황 코스피       올라     선 마감  거래일 연속 상승,0
 기대치 너무 낮았나   다시보이는 콘텐츠 ,0
 코스닥 마감 외국인 기관 매수에    선 회복,0
코스닥    선 재돌파 숨고르기 끝내고 다시 상승세,0
삼성전자   갤럭시 탭 S  S      일 사전판매,0
 개장  코스피      선 돌파  연고점 또 경신,0
 V자 반등 소외  CJ ENM  실적 개선에 주가 반등 시동 걸었나,0
코스닥  상승출발    선 향해 고삐 바짝,0
 TF매매동향  외국인   셀트리온  사고  LG화학  팔았다,0
 코스닥 마감 코로나   재확산 우려    선까지  뚝 ,0
코로나   재확산 우려에 코스닥 한때    까지 추락,0
코스닥     선서 하락 출발 숨고르기 길어지나,0
코스닥     선 회복 상승 출발   증시 호조 영향,0
 코스닥 마감  연준 우려에   대 급락     선  턱걸이 ,0
디앤씨미디어  수출 증가는 이제부터 시작 목표가  NH,0
디앤씨미디어  콘텐츠 수출 비중 급격 증가 NH,0
디앤씨미디어  글로벌 IP 기업으로 재평가 필요한 시점  NH,0
 코스닥 마감 외국인 기관  사자   강보합     선  근접,0
 코스닥 마감 외인 기관  사자     넘게 올라    선,0
유안타   제이콘텐트리  개봉 재개 한한령 해제 기대감 목표가  ,0
제이콘텐트리  지나친 저평가 구간 유안타 ,0
 마켓인사이트 JTBC스튜디오 프리IPO 적격후보  여곳 선정 매도자 vs  매수   ,0
 코스닥 마감  거래일만에    선 회복  코로나 수혜주 ,0
메드팩토  상장  개월 만에  시총 톱    눈앞,0
코스닥  나흘째 상승   거래일만에    선 회복,0
 코스닥 마감  거래일 만에 뒷걸음질    선대로 하락,0
CJ ENM  스튜디오드래곤 위즈덤 코미코와 웹툰 웹소설 공모전 총상금     만   ,0
CJ ENM  웹툰 웹소설 공모전 개최,0
허리띠 졸라맨 CJ  하반기 성과 가시화 기대 하나,0
CJ ENM  한류를 세계로  글로벌 콘텐츠 경쟁력 강화,0
CJ ENM 웹툰 웹소설 공모전 개최,0
코스닥  외인 기관 동반 팔자에 하락    선,0
팬엔터   겨울연가   제작 본격화 SK증권,0
 코스닥 마감  년  개월래 최고치  코로나 수혜주 상한가,0
매운 음식에 톡 쏘는 술  스트레스 해소   어때요 ,0
코스피  외국인 순매수에 상승하며     선  코스닥    선,0
예탁금   조 유동성 코로나 백신 증시 힘받나,0
코스닥 장중    선 돌파   년  개월 만에 최고점,0
코스닥  개인 사자에  년  개월 만에    선 돌파,0
오늘의 증시 일정   월   일 ,0
오늘의 증시 메모  월   일 ,0
 공모가 논란     억이상 공모주      마이너스 수익률,0
 증시일정   일 ,0
에이스토리   지리산  등 드라마 호조로 내년 최대 실적 하나,0
 클릭 e종목   에이스토리      년 사상 최대 실적 전망 ,0
물적분할 무조건 악재  CJ ENM은 올랐다,0
 특징주  에이스토리  드라마 수주 소식에 강세,0
에이스토리   지리산  방영권 판매 모멘텀 기대,0
 기업공시  월   일 에스티팜  글로벌 제약사와    억 규모 원료의약품 공급계   ,0
장 마감 후 기업공시  월   일 ,0
장 중 기업공시  월   일 ,0
스튜디오드래곤  강철구 김영규 공동 대표이사 체제로,0
 공시  스튜디오드래곤  강철구 김영규 공동 대표 선임,0
스튜디오드래곤  강철구 김영규 공동대표 체제로 변경,0
 BTS  빅히트 상장에 들썩이는 CJENM 숨겨진 수혜주 ,0
다가오는 빅히트 IPO 적정주가는 얼마,0
코스닥  롤러코스터급 변동성 상승 전환,0
에이스토리   지리산  방영권 수익    억원 확보 신한금융투자,0
 코스닥 마감 개인 외국인  사자 에    선 지켰다,0
스튜디오드래곤  멀티OTT 시대 및   재개방 기대감 키움,0
코스닥     선서 상승 출발 개인만  사자 ,0
 코스닥 마감 개인 나홀로  사자      선  약보합,0
 마감시황 코스피 약보합    외국인 매수세에      선 지켜,0
 오후주식시장은  기관 매도세에 코스피      선 이하로   개인 외국인은  사   ,0
 김대성의 종목분석  빅히트 공모 덕에 달궈진 엔터테인먼트  움직임은 ,0
코스피 약보합권서 거래 마쳐      선 유지,0
코스닥  개인  사자 에 상승 출발     선 ,0
코스피  뉴욕증시 기술주 급등에 상승 출발      대,0
 영화관이 문제야  CGV 제이콘텐트리는  DOWN   스튜디오드래곤은  매수 ,0
CJ 네이버  동맹     유통 콘텐츠 시너지 극대화  종합 ,0
네이버  CJ와  혈맹  맺는다 쇼핑 콘텐츠 시너지,0
네이버  CJ대한통운  대 주주 된다 콘텐트 물류 시너지 효과 내나,0
CJ 네이버  주식 맞교환으로 전략적 제휴 추진    콘텐츠 플랫폼 사업 경쟁력    ,0
CJ 네이버 연합전선 강화  주식 교환 추진,0
네이버  CJ와 사업 협력 방안 논의 중 ,0
CJ 네이버  전략적 제휴 추진  콘텐츠 물류   플랫폼  시너지 기대,0
네이버쇼핑 우군 얻고  CJ는 웹툰드라마 제작  등끼리 뭉친다,0
네이버  글로벌 엔터테인먼트 앞으로    SM YG 이어 CJ ENM  인 ,0
CJ  네이버와 포괄적 사업협력  물류 콘텐츠 분야 시너지 ,0
 마켓인사이트 네이버 CJ그룹  이커머스 콘텐츠 플랫폼  피 섞는다  M A보다    ,0
네이버 CJ그룹  쇼핑 콘텐츠 물류  손잡는다  시너지 극대화 ,0
 공동의 적  카카오    CJ 유례없는 협력  왜  네이버 였나,0
쇼핑 키우는 네이버  CJ와  물류 동맹 ,0
CJ 네이버  주식 맞바꿔  물류 콘텐츠 동맹 ,0
CJ   네이버 손잡고 한국판 아마존 띄운다,0
CJ 네이버 약점 보완 주가 중장기 긍정적,0
네이버 CJ 혈맹 키워드는  글로벌 역량 과  수익성 강화 ,0
CJ   네이버  쇼핑 물류 콘텐츠  동맹 ,0
한 배를 탄 네이버 CJ  주가는 엇갈렸다,0
 시그널  네이버와 웹드라마 양대산맥    TV     억 투자유치 나서,0
 언택트 대장주  네이버  기사회생 노린다,0
