뉴스제목,주가변동
코스피   대 하락     선 밀려  미중 갈등 우려 ,1
 개장  코스피  미 중 마찰 확대에 소폭하락      선  턱밑 ,1
코스닥  상승 출발 또다시 연중 최고치 경신,1
K드라마에 빠진게 죄는 아니잖아,1
 TF시황  코스피  미 중 갈등에도 강세 마감,1
 오후시황 글로벌 경제활동 재개 기대   코스피 코스닥 나란히   대 강세,1
CJ ENM 스튜디오드래곤       억 투자,1
CJ ENM 스튜디오드래곤      억 투자,1
 모든 조건이 최악 미디어  반등만 남았다 ,1
상승출발 코스피 개인 기관 매수세에     선 유지중,1
대신증권  스튜디오드래곤  안정적인 수익구조 확보 목표가 유지 ,1
스튜디오드래곤  코로나에도 실적 하향 없다 최선호주 하나,1
스튜디오드래곤  드라마 제작 증가 이익구조 안정적 대신,1
 클릭 e종목   가진 건 콘텐츠 밖에 없다  스튜디오드래곤  본격 성장 시작,1
 바닥 확인 미디어  반등만 남았다 ,1
코스닥      갈등 고조에도 개인 매수에 상승 출발    선 상회,1
 I 리포트  스튜디오드래곤  콘텐츠 높은 잠재력 기대 대신 ,1
스튜디오드래곤  성장 이제 시작일 뿐 대신증권,1
 스튜디오드래곤  실적 구조 안정적  대신증권,1
바이오 IT 기업  대약진  시총 순위 지각 변동,1
  일  코스닥 외국인 순매수상위에 연구 개발 업종  종목,1
언택트 바통 받은  차 전지 코스피  달 반만     선 탈환,1
코로나가 바꾼 시총 지형  바이오 대약진,1
코스피  코로나 사태 후 처음으로  천 선 돌파          마감,1
 TF시황  경기회복 기대감에 국내증시  강세 ,1
 마감  코스피  두달 반 만에     선 넘었다      선  눈앞 ,1
 장하다  코스피  두달 반 만에     선 탈환 경제 재개 기대,1
 시황종합  코스피       상승     선 눈앞 코로나 이전으로,1
 마감시황 코스피       상승해     선  턱밑  두달 반만에 최고,1
코스피   대 상승     선 돌파 코로나   이전 회복,1
코스피  장중     선 돌파   두달 반 만에 처음,1
코로나로 시총 순위 지각변동 바이오 IT기업 대거    위 진입,1
코스피    상승     선도 돌파   시간외 선물 올라,1
 개장  코스피     선 탈환  개미가 만들어냈다,1
코로나   이후  시총    위권 중   곳  자리교체  총액은    조 하락,1
 코스닥 마감 개인매수에   대    개월만에    선 회복,1
코스피    거래일만 장중     선 돌파 경제 재개 기대,1
 개장시황  코스피  주요국 코로나   완화 조짐에 상승세,1
글로벌 경제 재개 기대에 코스닥 상승 출발     선 안착 시도,1
코스피  미중 마찰에도 백신 기대감에 강보합          마감,1
 마감  코스피  미 중 갈등에도 개인  사자  행렬  소폭상승,1
 TF시황  코스피  개인 매수에 소폭 상승     선 마감,1
 시황종합  코스피 강보합        삼성전자  네이버 카카오 ,1
코스피      갈등 우려에     선 보합권 마감,1
 마감시황 코스피      선 앞두고 강보합 마감 막판 상승 반전,1
 코스닥 마감   갈등 우려 불구 외인 매수에  상승     선 상회,1
코스피 소폭 하락     선   시간외 선물 하락,1
코스피 소폭 하락     선 턱걸이 코스닥은 강보합,1
 개장  코스피  미 중 마찰 확대 영향 하락  외국인  팔자  주도,1
코스피      마찰 확대 우려에 내리며     선  코스닥 강보합,1
한화   스튜디오드래곤  해외판권 서프라이즈 지속될 것 ,1
 마감시황  코스피  기관 매물 축소에 반등 성공 강보합,1
코스닥  미중 갈등 우려에 보합권 등락   혼조세 ,1
코스닥     갈등우려에 투심 위축  하락 전환,1
 개장시황  코스피      홍콩보안법 충돌에 하락세,1
코스닥  하락 출발후 상승 전환     나흘만에  사자 ,1
 호텔가  서울드래곤시티    시간 호캉스 패키지 출시,1
코스피  파죽지세  석달 만에      선  회복 ,1
 코스닥 마감 외인 기관 매수에   대   년여만에    선 위로,1
 시황종합      사자  코스피     선 넘고 코스닥    급등,1
 TF시황  외인 기관 동반 매수에 국내증시 상승  견조 ,1
 마감시황 코스피  기관 외국인 쌍끌이에       상승     선 회복,1
 언택트 하면 빠질 수 없다 콘텐츠  언제 오르나,1
 오늘의 유통 단신  GS     진심 고맙군  캠페인 전개  ,1
   시간  역대급 호캉스 상품 내놓은 서울드래곤시티,1
공룡  빅히트  온다 엔터주 삼국지  흔들 ,1
서울드래곤시티     시간 호캉스  패키지 출시  국내 최장 시간,1
엔터주 삼국지 판 깨진다 BTS의 빅히트  엔터주 전부보다 큰 하나  예고,1
코스피    올라      턱밑 코스닥도      상승,1
코스피  개인 외국인 매수세에        로 상승 출발,1
동학개미 거침없는 빚투자   년 최장 증가,1
 코로나   타격  제이콘텐트리  물적분할  승부수  통할까,1
  일  코스닥 기관 순매수상위에 반도체 업종  종목,1
드라마 부문 떼내 제이콘텐트리 다시  뜀박질 ,1
 TF시황  코스피  기관 매수에     선 마감,1
 마감시황 코스피  경기개선 기대감에 상승세     선 마감,1
 시황종합  코스피  개월만에     선 눈앞 잭팟 조선  급등,1
코스피   일 연속 오르며     선 마감  코스닥    선 회복,1
 마감  코스피    대 상승  이젠     선  목전 ,1
 포스트 코로나  시대 패러다임 변화 속 수혜주 총정리,1
 빅히트 상장  낙수효과  누릴 수도  JYP 살까 SM 살까 ,1
 개장  코스피      선 회복  하락 출발 뒤 상승 전환,1
 특징주  제이콘텐트리  드라마 사업부문 물적분할에 강세,1
 제이콘텐트리 드라마 부문 물적 분할  긍정적  하나,1
제이콘텐트리  물적분할 결정 중기적 호재로 작용 전망 NH,1
부부의세계 사랑의불시착    흥행  사두면 돈되는 종목 ,1
제 의 스튜디오드래곤 탄생    드라마부문 물적 분할에 제이콘텐트리 주가 ,1
코스피      선 접근    추가랠리 기대감 고조 ,1
 특징주 제이콘텐트리  드라마 부문 물적 분할 소식에 강세,1
  일  코스닥 기관 순매도상위에 연구 개발 업종  종목,1
 마감  코스피  이젠     선  눈앞   기관 덕에       상승,1
 TF시황  코스피  기관  사자 에 상승     선 마감,1
 마감시황 코스피  기관이 이끈 상승장 행진     선 마감,1
 시황종합  코스피 석달만에     선 넘어 코스닥도      ,1
연고점 까지   포인트 남았다 코스피       선 탈환,1
코스피 상승 확대     선   지수 선물 오름세,1
지수시총비중 느는 카카오 주가 더 뛸까,1
코스피  차익매물에 보합권 공방 코스닥도 혼조세,1
지수시총비중  카카오 스튜디오드래곤  늘고   삼성전자 네이버  준다,1
 개장  코스피 강보합      선 유지  기관 외인 동반 매도,1
코스피     선으로 주저앉아 코스닥도 동반 하락세,1
SBS   Q부터 제작비 절감 노력 가시화 실적 반등 하나,1
 클릭 e종목  SBS  하반기 제작비 절감 노력 가시화로 반등 예상 ,1
 마감시황  코스피   일째 거침없는 질주      탈환,1
 연고점 보인다    코스피  거래일 연속 상승하며     선 돌파,1
외국계 순매수 금액 상위   선   코스닥,1
  일  코스닥 외국인 순매수상위에 제약 업종  종목,1
  일  코스닥 기관 순매수상위에 제약 업종  종목,1
 TF매매동향  외국인   삼성SDI  사고  삼성전자  팔았다,1
 시황종합  코스피 한때     선 넘어 강보합     선 마감,1
 TF시황  코스피  기관 매도에     선 마감,1
 마감시황 외국인 막판 매수 가세에 코스피 코스닥 동반 상승 마감,1
 마감시황 코스피  롤러코스터 끝에 강보합 한때     서 거래,1
코스피   거래일 연속 상승 차익실현에 상승폭 제한,1
코스피   개월반 만에     선 매매 공방,1
 개장  코스피 장중     선 탈환   V자형 경기 회복 가능성 높여 ,1
 마켓인  본방사수 시대 끝났다  열기 뿜어내는 OTT 대전,1
 마감시황  코스피  거래일 연속 상승  장중      돌파,1
  일  외국인 코스닥에서 셀트리온헬스케어          셀트리온제약         ,1
  일  코스닥 기관 순매수상위에 제약 업종  종목,1
 TF매매동향  외국인   삼성전자  사고  LG화학  팔았다,1
 코스닥 마감 막판 상승전환    선 강보합,1
 마감시황 코스피  이틀 연속 강보합     선 목전,1
 시황종합 이틀 연속      도전한 코스피 차익매물에     선 마감,1
 마감  코스피  개인  사자 에 강보합      선 유지,1
코스피   거래일 연속 상승 마감  코스닥 강보합,1
코스피  개인  사자 에  거래일 연속 상승      선 숨고르기,1
 TF시황  개인 매수 역부족 코스피 강보합 마감,1
 마감시황  코스피  소폭 강세로 거래 마감,1
 오후 주식시장은  장중       넘겼지만        선 밑으로 떨어진 코스피,1
 주식 초고수는 지금 스튜디오드래곤 에코프로비엠 집중 매수   셀트리온  형제 매   ,1
코스피 하락 전환     선 밀려 코스닥도 내림세,1
코스피  하락반전 에     선으로 개인 순매수세 ,1
코스피      선 넘기며 출발 삼성 계열사 호조세,1
 개장  코스피     선 돌파  경제 회복 낙관론에   대 급등,1
 특징주  스튜디오드래곤  매수 집중에  강세  한류 콘텐츠 기대감,1
코스피 상승 출발 장중      선 돌파,1
 TF시황   도발 등 겹악재 코스피     선까지  후퇴 ,1
 마감시황 코스피    긴장 고조 코로나 재확산 우려에   대 ,1
코스피   대 코스닥  대 폭락  시총 톱   대부분  우수수 ,1
 코스닥 마감 엎친데 덮쳤다    폭락해    선 하회,1
 개장      보던 코스피   거래일 하락  이젠     선 위협 걱정,1
코스닥    대 낙폭 확대  한때    선 내주기도,1
코스닥  외인 기관 동반 매도에   대     선 아래로,1
코스피 사흘 연속 하락중 또 늘어나는 외국인 매도,1
  일  외국인 코스닥에서 씨젠          국일제지         등 순매도,1
 TF시황    넘는 급등 코스피 코스닥 사이드카 발동,1
 마감  코스피    대 급반등  장중 매수 사이드카 발동,1
 마감시황 코스피  하루만에    반등 양대시장 매수 사이드카,1
 연준 부양책에 국내증시 급반등 코스피      선 탈환,1
코스닥     급등에 석달만에 사이드카 발동,1
 개장  코스피  미국 연준 부양책에   대 상승      선 코앞,1
코스닥  연준 부양책 기대감에    반등 출발     선 ,1
코스닥  반발매수 유입에    선 회복,1
  일  외국인 코스닥에서 에코프로비엠          에이치엘비            ,1
 TF시황  외인 기관 매도에 코스피 하락 마감,1
코스피  코로나 재확산 우려에 소폭 하락          마감,1
 개장  코스피 외국인 기관 동반 매도      선 약보합,1
문화는 강했다 코로나 봉쇄 뚫은  K콘텐츠 ,1
  일  코스닥 기관 순매수상위에 반도체 업종  종목,1
 넷플릭스 텐센트  경쟁에 K콘텐츠  날개,1
넷플릭스 텐센트 충돌 예고 고래싸움이 반가운 한국콘텐츠 ,1
 빅데이터로 본 재테크  코로나에 주목받는 콘텐츠  니콜라 잭팟에 수소차  관심,1
코스닥  개인  사자 에 상승 출발     선 ,1
  일  기관 코스닥에서 엘앤에프          동진쎄미켐         등 순   ,1
CJ  제일제당 ENM 가치 지속 부각 목표가  삼성,1
코스닥 시총 톱  휩쓴 바이오  싼 주식은  옛말 ,1
 코스닥 마감 코로나   재확산 우려에 투심위축   거래일만에  하락 ,1
코스닥  외국인 기관 매물 확대에    이상 하락     선 하회,1
코스닥  코로나   확산 우려에 하락 출발,1
유아인 이효리도   억 꽂았다  이태원 부동산  아우라에 반한 별들,1
코로나   재확산 우려 코스닥  하락 출발    선 아래로,1
    대 CEO  이재현 CJ 회장  활발한 인수 합병으로 글로벌 영토 확장에    ,1
  일  외국인 코스닥에서 앱클론          에이비엘바이오         등   ,1
  일  코스닥 기관 순매수상위에 반도체 업종  종목,1
한한령 풀린다는데 웃지못한  소비주,1
중국소비  대표주자     화장품보다 미디어 엔터 ,1
 TF시황  코스피  외국인 매도에     선으로 후퇴,1
 시황종합   월 첫날 코스피 약보합  바이오  약세  코스닥      ,1
 코스닥 마감 퐁당퐁당 장세    선대로 하락,1
 마감  코스피  외국인 매도 우위에 하락        ,1
 마감시황 코스피  미 중 마찰 확산에 약보합 마감,1
동학개미  상반기   조 순매수 외인 기관 매물 이겨냈다,1
  한한령 해제 기대감  게임 콘텐츠 업종 실수혜 전망 ,1
 주식 초고수는 지금  삼성SDI  사자    스튜디오드래곤은  팔자 ,1
 개장  개인 순매수에 코스피     선 안착,1
  월 첫날  코스피    올라     선 코스닥      ,1
대신증권  스튜디오드래곤    한한령 해제시 이익 개선 ,1
스튜디오드래곤   시장 열리면 큰 폭 이익 개선 가능 대신,1
코스닥  외인 기관 팔자에 하락     선,1
코스닥  개인 외인 사자에 상승 출발     선,1
코스피   증시 훈풍에    가까이 상승,1
  일  기관 코스닥에서 스튜디오드래곤          셀트리온헬스케어         ,1
  일  코스닥 외국인 순매수상위에 제약 업종  종목,1
   한한령  풀린다고  영화 드라마   꿈틀 ,1
반년 만에 코스닥 돌아온 외국인 뭘 담았지   월 한달동안     억어치 사들여,1
 TF매매동향  외국인   카카오  사고  삼성SDI  팔았다,1
 마감   거래일 연속 기관  사자  행진  코스피     선  회복 ,1
 시황종합  코스피       SK바이오팜  따상 에 바이오 동반 강세,1
코로나백신 SK바이오팜 훈풍 코스피     선  회복 ,1
 TF시황   상승 곡선  국내 증시 코스피      선 회복,1
 마감시황 코스피  기관 매수에      상승     선 회복,1
 코스닥 마감  경기회복 기대에 나흘 만에    선 회복,1
스튜디오드래곤  코로나 한한령 해제 기대감에  훨훨  계속 오를까,1
 주식 초고수는 지금 셀트리온 SK  사자     알테오젠은  팔자 ,1
 개장  코스피  코로나   백신 기대감에 상승      선  유지 ,1
 개장시황  코스피 상승 출발 증시 입성 SK바이오팜 개장 직후  상한가 ,1
 집중분석 이슈타임 한한령 해제한다는데 웃지못한  소비주,1
콘텐츠   넷플릭스에  한한령 해제 호재까지   예단 말아야 ,1
SK바이오팜 상장에 제약 바이오주 동반 상승  코스피    코스닥    ,1
  한한령 해제 기대감에 영화 드라마 엔터주 일제히 강세,1
 코스닥 마감   대 상승    선 외국인 이틀 연속 매수,1
 마감  코스피      선 뚫었다   사자  행진에 이틀 연속 상승,1
 마감시황 코스피  기관 외인 동반 매수세에 상승,1
 TF시황  코스피 외인 기관 매수에 상승     선 마감,1
 시황종합 코스피     선 올라  외인 기관 사자  코스닥      ,1
코스피 코스닥  외인 기관 순매도에 보합권 하락,1
 개장  코스피      선 뚫을까  뉴욕발  훈풍 에 상승중,1
코스피 코스닥 개인 매수세에 소폭 상승,1
 fnRASSI 스튜디오드래곤    주 신고가          ,1
 스튜디오드래곤    주 신고가 경신  데이터화되는 흥행 지표의 높은 수혜   하   ,1
코스피  미국 고용지표 호조에      선 돌파,1
 fnRASSI 스튜디오드래곤    주 신고가          ,1
코스닥    증시 훈풍에 강보합권 출발     선  등락,1
코스피    고용지표 호조에 상승      회복,1
기관  거래일 순매수   코스피     선 회복,1
 마감시황 코스피  기관 대량 매수세에      상승,1
 TF시황  코스피  기관  사자 에 강세     선 마감,1
 시황종합  코스피  기관 사자에     선  D    삼성전자  일째 ,1
 코스닥 마감 개인 출격에     선  바짝 IT 강세,1
 마감  코스피     선 눈앞  정의선 최태원 동맹 등 굵직한 현안  투자심리    ,1
스튜디오드래곤  이시간 주가            최근  일 개인   만     주   ,1
 개장  코스피      선 돌파  개인  사자  행렬 지속,1
코스피        상승   거래일만에      회복,1
경제지표 회복 vs 코로나 바이러스 재확산  선택  오늘의 종목 ,1
코스닥  코로나   재유행 우려에     선  보합권서 출발,1
  일  코스닥 기관 순매도상위에 연구 개발 업종  종목,1
콘텐츠 홈런에 겨울잠 깨는 CJ ENM,1
 시황종합  코스피    떨어져     선  깜짝실적 에도       ,1
 TF시황  국내증시  외인 기관 매도에  약세 ,1
 코스닥 마감 나흘만에 하락 하반기 실적 의구심,1
 마감  외국인 기관 팔자에 코스피    대 하락      선  털썩 ,1
 콘텐츠 왕국  넘어뜨린 역대급 주가부진 삼시세끼  CJ ENM 살릴까,1
코스닥 상장사 연봉  위 셀트리온헬스케어  억    만원,1
코스피  하락 전환     선 밀려 코스닥도 소폭 내림세,1
코스닥 상장사 연봉  위 셀트리온헬스케어  억    만원  위는 ,1
 평균  억    만원  코스닥 상장사 연봉  위는 ,1
코스닥 상장사 연봉  위 셀트리온    억   위도  억  넘는다,1
      상반기 베스트 애널리스트  이기훈  한한령 완화로 하반기 엔터주 잠재력   ,1
 개장  코스피     선 회복  미국 증시 훈풍에 다시 날았다,1
코스피   증시 훈풍에     선 돌파,1
 Hot Line   컴투스  서머너즈워 IP 가능성 확인  목표가 ,1
코스닥  거세진 외국인 매도에 하락반전    선 하회,1
코스닥     선서 상승 출발 개인 기관  사자 ,1
삼성전자 깜짝실적 코스피      돌파,1
CJ ENM 하반기 분위기 반전 시도 예상,1
씨젠  코스닥 시총  위 안착 셀트리온 제쳤다,1
 코스닥 마감 코로나   재확산에 약보합 씨젠  시총  위 ,1
카카오페이지  웹소설 스타트업에    억 배팅  이유는 ,1
 Hot Line   스튜디오드래곤  해외 진출 확대 높아진 수익성으로 성장 기대   ,1
 연예기획사처럼 극초기기업 발굴해 투자하고 키워나가죠 ,1
스튜디오드래곤  글로벌 시장 진출 가속화 현대차증권,1
대형 신작 안보이네  펄어비스  기관   일째  팔자 ,1
CJ ENM  장편소설  파우스터  영상화 작업한다,1
 사이코지만 괜찮아     여개국서  인기    K드라마의 위력,1
씨젠 올들어      급등 바이오  언제까지 달릴까,1
CJ ENM  위즈덤하우스 IP로 영상 콘텐츠 만든다,1
코스피   일 연속 내리며     선 턱걸이 마감  코스닥    선 회귀,1
  증시 약세에 코스닥 하락 출발     선 아래로 ,1
제주신화월드 스튜디오드래곤  IP 복합리조트 활용 공동 사업 맞손,1
 마켓인 블루포인트파트너스  시드와 시리즈A 연결하는 브릿지 펀드 만든다,1
 황시목은 법과 원칙에 의해 묵묵히 자신의 길을 걷는다 ,1
제주신화월드   도깨비   사랑의 불시착  제작사와 손잡다,1
코스피  개인  사자 에     선 마감  코스닥   일 연속 오르며 한 주 마감,1
  분기 최대매출  스튜디오드래곤  분기 버티고  분기 계속  GO ,1
스튜디오드래곤  기타 매출 효과로  Q 실적 기대치 상회 메리츠,1
 클릭 e종목  스튜디오드래곤   분기 호실적 하반기엔 더욱 성장 ,1
  차 전지  강세 속 코스피      선 돌파 나흘 연속 연고점 경신,1
실적 대작흥행 언택트 수혜 스튜디오드래곤  긍정의  박자 ,1
코스피      선 돌파 또 장중 연고점 경신,1
코스닥    거래일 연속 상승 출발    선 코앞,1
 Hot Line   스튜디오드래곤  해외판권 서프라이즈 지속 전망 ,1
스튜디오드래곤  하반기가 더 기대된다 대신증권,1
스튜디오드래곤  넷플릭스 드라마 판매 늘어날 것 신한,1
 e종목 눈에 띄네 코스닥  일,1
 기업공시  월  일 한진       억원 규모 유상증자 결정 등,1
 재송  일 장 마감 후 주요 종목뉴스,1
지성 한지민  아는 와이프   후지TV 리메이크,1
 TF매매동향  외국인   카카오  사고  SK하이닉스  팔았다,1
 코스닥 마감  코로나     급락세     선 턱걸이 진단키트  씨젠  ,1
 코로나 재확산  코스피     선 후퇴 코스닥    급락,1
 코로나 재확산  코스피 소폭 하락     선 공방 언택트  동반 상승,1
코스닥     선서 하락 출발  코로나    확산세 영향,1
코스닥  외국인 기관  팔자 에   대 급락     선  털썩 씨젠만 ,1
 코스닥 마감 외국인 기관 쌍끌이  거래일만에    선  복귀 ,1
 김대성의 종목분석  코로나  가 올들어 엔터테인먼트 주가에 미친 영향은 ,1
 증권  짧게는 자동차  올라타고 긴 호흡으론 IT 바이오  주목,1
갤럭시Z폴드 도 톰브라운 입었다    만원,1
LGU     G 콘텐츠 연합체  주도 NASA와 우주 촬영 종합 ,1
 코스닥 마감 돌아온 개인에 상승 마감    선 위로,1
LG유플러스  글로벌  G콘텐츠 연합체 결성,1
세계 첫  G콘텐츠 국제연합체 출범   LGU 가 초대 의장,1
키움증권  스튜디오드래곤  수익성 기반 사업 강화 전망 ,1
스튜디오드래곤   분기 캡티브 편성 강화로 긍정적 키움,1
코스닥  개인 매수세에 강보합 출발    선 공방,1
스튜디오드래곤  드라마강자 위치 확인 키움 ,1
BTS  빌보드  위  다음날 빅히트  공모 돌입,1
BTS  빅히트 에  상장 앞둔 빅히트  몸값만  조 이상  IPO 열풍 넘어 광   ,1
카카오게임즈  다음 타자는  BTS    조 모은다 ,1
 마켓인사이트 단독 BTS  위하자마자 IPO 돌입한 빅히트  다음달 최대       ,1
 클릭 e종목  스튜디오드래곤  해외 기대감 빛나 ,1
DB금투  스튜디오드래곤  제작중단 영향 안 커 비중확대 긍정적 ,1
스튜디오드래곤  매출 감소 불가피     해외 콘텐츠 판매 긍정적 신영,1
한달간  조 판 외국인  저평가 가치주는 샀다,1
스튜디오드래곤  최근 주가 하락은 일시적 DB투자,1
 스튜디오드래곤  콘텐츠 업종 최선호주  DB금융투자,1
스튜디오드래곤  넷플릭스 등 OTT향 매출 기대감    신영,1
 증시 하락 영향  시총상위주  일제히  파란불 ,1
현대차증권  스튜디오드래곤  추가적 글로벌 판매 확대 가능성 주목 ,1
스튜디오드래곤   K 드라마  확산의 중심 현대차,1
스튜디오드래곤  안정적인 작품 라인업 보유 현대차증권,1
스튜디오드래곤  넷플릭스 기반 글로벌 성장세 지속 현대차,1
 코스닥 마감   조정 여파에    하락     선 깨져,1
 증시 폭락에 코스닥도   대 하락 출발,1
드라마  청춘기록  팬엔터       무상증자 실시,1
 스튜디오드래곤 시총  조 가능 지금이 매수 기회 ,1
신한금투  스튜디오드래곤  아시아 대표 제작사 목표가   만원 ,1
스튜디오드래곤  시총    가능 매수 최적 신한,1
신한금투  스튜디오드래곤  국내외 콘텐츠 수요 증가 수혜 ,1
공효진이 밀고 박보검이 끌어주는 종목 역대급 이익 증가율 기대,1
스튜디오드래곤    대표 제작사  최적의 매수 시점  신한,1
바이오 몰빵했던 개미들  뉴딜 콘텐츠 도  줍줍 ,1
 TF매매동향  외국인   삼성전자  사고  삼성전자우  팔았다,1
반년 만에      넘게 오른 코스닥  더 오른다 ,1
 청춘기록  순항 팬엔터  작년  동백꽃  영광 재현할까,1
 코스닥 기업공시     일  에스티팜 등,1
장 중 기업공시  월   일 ,1
에이스토리  스튜디오드래곤과    억 규모 드라마 방영권 계약,1
에이스토리  전지현 주연  지리산     억원 규모 공급계약 체결,1
에이스토리  스튜디오드래곤과    억 규모 방영권 계약,1
킹덤 신드롬 쓴 에이스토리   지리산  타고 재도약 노린다,1
킹덤 막판에 등장했던 전지현  지리산에 뜨니 에이스토리 주가  훨훨 ,1
코스닥  개인 팔자   대 하락    선,1
코스닥  개인 기관 팔자에 하락 출발     선 ,1
 김대성의 종목분석  CJ그룹 시총   조원 한진 신세계 시총 각각  조원,1
 코스닥 마감 멀미나는 변동성    선 지켜,1
코스닥    대 상승 출발     선 ,1
스튜디오드래곤 목표주가     만원 매수 대신,1
 업종공략  언택트  정유  스튜디오드래곤,1
코스닥  개인 외국인 매수에 장중   대 상승,1
코스닥  개인 매수세에   대 상승 출발,1
 스트리밍 공룡   시장 공습 K콘텐츠 웃고  플랫폼 울고,1
 스튜디오드래곤  한류 대표 콘텐츠 사업자   목표가   신한금융투자,1
신한금투  스튜디오드래곤  해외 판권 매출액 고성장 목표가  ,1
스튜디오드래곤  해외 판권 매출액 고성장 기대 목표가  신한,1
 클릭 e종목   스튜디오드래곤  국내외 모두  러브콜  ,1
코스피  미국 부양책 협상 중단에 하락 출발      대,1
